test,category
"㉠ 특정 주제를 깊이 있게 탐구하기 위한 독서는 지식을 습득하고 이를 비판적ㆍ종합적으로 탐구하는 독서이다. 이러한 독서는 목차나 책 전체를 훑어보아 글의 전체 구조를 파악하고, 필요한 부분을 찾아 중점적으로 읽을 내용을 선별하는 것으로부터 출발한다. 이어 독자는 글 표면에 드러난 내용을 정확하고 충분하게 읽기, 글 이면의 내용을 추론하고 비판하며 읽기, 여러 관점을 비교하고 종합하며 읽기와 같은 방법을 적절히 조합하여 선별한 내용을 읽게 된다. 위 과정에서 독자는 자신의 배경지식과 새로이 얻은 지식을 통합하여 의미를 구성한다. 그런데 이렇게 개인의 머릿속에서 구성된 의미는 다른 사회 구성원들과의 상호 작용을 거쳐 재구성된다. 따라서 특정 주제를 깊이 있게 탐구하기 위한 독서의 의미 구성은 개인적 차원뿐 아니라 사회적 차원에서도 이루어지는 것으로 이해되어야 한다. 이를 감안하면 특정 주제를 깊이 있게 탐구하기 위한 독서에서는 기록의 역할이 부각된다. 탐구 과정에서 개인적으로 구성한 의미를 기록하는 것은 읽은 내용의 망각을 방지하며, 비판과 토론의 자료로서 사회적 차원의 의미 구성에 기여한다. 또한 보고서, 논문, 단행본 등의 형태로 발전하여 공동체의 지식이 축적되는 토대를 이룬다. 이렇게 볼 때 특정 주제를 깊이 있게 탐구하기 위한 독서는 학문 탐구의 과정에서 글을 읽고 의견을 주고받으며 토론하는 강론 또는 기록을 권유했던 전통과도 맥을 같이한다.",독서
"(가) 근대 이후 서양의 철학자들은 과학적 세계관이 대두하면서 이전과는 달리 인과를 물리적 작용 사이의 관계로 국한하려는 경향을 보였다. 문제는 흄이 지적했듯이 인과 관계 그 자체는 직접 관찰할 수 없다는 것이다. 원인과 결과에 해당하는 사건만을 관찰할 수 있을 뿐이다. 가령 “추위 때문에 강물이 얼었다.”는 직접 관찰한 물리적 사실을 진술한 것이 아니다. 그래서 인과가 과학적 개념인지에 대한 의심이 철학자들 사이에 제기되었다. 이에 인과를 과학적 세계관에 입각하여 이해하려는 시도가 새먼의 과정 이론이다. 야구공을 던지면 땅 위의 공 그림자도 따라 움직인다. 공이 움직여서 그림자가 움직인 것이지 그림자 자체가 움직여서 그림자의 위치가 변한 것은 아니다. 과정 이론은 이 차이를 다음과 같이 설명한다. 과정은 대상의 시공간적 궤적이다. 날아가는 야구공은 물론이고 땅에 멈추어 있는 공도 시간은 흘러가고 있기에 시공간적 궤적을 그리고 있다. 공이 멈추어 있는 상태도 과정인 것이다. 그런데 모든 과정이 인과적 과정은 아니다. 어떤 과정은 다른 과정과 한 시공간적 지점에서 만난다. 즉, 두 과정이 교차한다. 만약 교차에서 표지, 즉 대상의 변화된 물리적 속성이 도입되면 이후의 모든 지점에서 그 표지를 전달할 수 있는 과정이 인과적 과정이다. 가령 바나나가 a 지점에서 b 지점까지 이동하는 과정을 과정1이라고 하자. a와 b의 중간 지점에서 바나나를 한 입 베어 내는 과정 2가 과정 1과 교차했다. 이 교차로 표지가 과정 1에 도입되었고 이 표지는 b까지 전달될 수 있다. 즉, 바나나는 베어 낸 만큼이 없어진 채로 줄곧 b까지 이동할 수 있다. 따라서 과정1은 인과적 과정이다. 바나나가 이동한 것이 바나나가 b에 위치한 결과의 원인인 것이다. 한편, 바나나의 그림자가 스크린에 생긴다고 하자. 바나나의 그림자가 스크린상의 a′지점에서 b′지점까지 움직이는 과정을 과정 3이라 하자. 과정 1과 과정 2의 교차 이후 스크린상의 그림자 역시 변한다. 그런데 a′과 b′사이의 스크린 표면의 한 지점에 울퉁불퉁한 스티로폼이 부착되는 과정4가 과정3과 교차했다고 하자. 그림자가 그 지점과 겹치면서 일그러짐이라는 표지가 과정 3에 도입되지만, 그 지점을 지나가면 그림자는 다시 원래대로 돌아오고 스티로폼은 그대로이다. 이처럼 과정3은 다른 과정과의 교차로 도입된 표지를 전달할 수 없다. 과정 이론은 규범이나 마음과 같은, 물리적 세계 바깥의 측면을 해명하기 어렵다는 한계를 지닌다. 예컨대 내가 사회 규범을 어긴 것과 내가 벌을 받아야 하는 것 사이에는 인과 관계가 있지만 과정 이론은 이를 잘 다루지 못한다. (나) 자연 현상과 인간사를 인과 관계로 설명하는 동아시아의 대표적 논의는 재이론(災異論)이다. 한대(漢代)의 동중서는 하늘이 덕을 잃은 군주에게 재이를 내려 견책한다는 천견설과, 인간과 하늘에 공통된 음양의 기(氣)를 통해 하늘과 인간이 서로 감응한다는 천인감응론을 결합하여 재이론을 체계화하였다. 그에 따르면, 군주가 실정(失政)을 저지르면 그로 말미암아 변화된 음양의 기를 통해 감응한 하늘이 가뭄과 홍수, 일식과 월식 등 재이를 통해 경고를 내린다. 이때 재이는 군주권이 하늘로부터 비롯된 것임을 입증하는 것이자 군주의 실정에 대한 경고였다. 양면적 성격의 재이론은 신하가 정치적 논의에 참여할 수 있는 명분을 제공하였고, 재이가 발생하면 군주가 직언을 구하고 신하가 이에 응하는 전통으로 구체화되었다. 하지만 동중서 이후, 원인으로서의 인간사와 결과로서의 재이를 일대일로 대응시켜 설명하는 개별적 대응 방식은 억지가 심하다는 평가를 받았다. 이 방식은 오히려 ㉠ 예언화 경향으로 이어져 재이를 인간사의 징조로, 인간사를 재이의 결과로 대응시키는 풍조를 낳기도 하였고, 요망한 말로 백성을 미혹시켰다는 이유로 군주가 직언을 하는 신하를 탄압하는 빌미가 되기도 하였다.
이후 재이에 대한 예언적 해석은 비판의 대상이 되었고, 천인 감응론 또한 부정되기도 하였다. 하지만 재이론은 여전히 정치 현장에서 사라지지 않았다. 송대(宋代)에 이르러, 주희는 천문학의 발달로 예측 가능하게 된 일월식을 재이로 간주하지 않는 경향을 수용하였고, 재이를 근본적으로 이치에 의해 설명되기 어려운 자연 현상으로 간주하였다. 하지만 당시까지도 재이에 대해 군주의 적극적인 대응을 유도하며 안전한 언론 활동의 기회를 제공했던 재이론이 폐기되는 것은, 신하의 입장에서 유용한 정치적 기제를 잃는 것이었다. 이 때문에 그는 군주를 경계하는 적절한 방법을 ⓐ 찾고자 재이론을 고수하였다. 그는 재이에 대한 개별적 대응 대신 군주에게 허물과 잘못이 쌓이면 이에 하늘이 감응하여 변칙적인 자연 현상이 일어날 것이라는 ㉡ 전반적 대응설을 제시하고, 재이를 군주의 심성 수양 문제로 귀결시키며 재이론의 역사적 수명을 연장하였다",인문
"1764년에 발간된 체사레 베카리아의 ?범죄와 형벌?은 커다란 반향을 일으켰다. 형벌에 관한 논리 정연하고 새로운 주장들에 유럽의 지식 사회가 매료된 것이다. 자유와 행복을 추구하는 이성적인 인간을 상정하는 당시 계몽주의 사조에 베카리아는 충실히 호응하여, 이익을 저울질할 줄 알고 그에 따라 행동하는 존재로서 인간을 전제하였다. 사람은 대가 없이 공익만을 위하여 자유를 내어놓지는 않는다. 끊임없는 전쟁과 같은 상태에서 벗어나기 위하여 자유의 일부를 떼어 주고 나머지 자유의 몫을 평온하게 ⓐ 누리기로 합의한 것이다. 저마다 할애한 자유의 총합이 주권을 구성하고, 주권자가 이를 위탁받아 관리한다. 따라서 사회의 형성과 지속을 위한 조건이라 할 법은 저마다의 행복을 증진시킬 때 가장 잘 준수되며, 전체 복리를 위해 법 위반자에게 설정된 것이 형벌이다. 이런 논증으로 베카리아는 형벌권의 행사는 양도의 범위를 벗어날 수 없다는 출발점을 세웠다. 베카리아가 볼 때, 형벌은 범죄가 일으킨 결과를 되돌려 놓을 수 없다. 또한 인간을 괴롭히는 것 자체가 그 목적인 것도 아니다. 형벌의 목적은 오로지 범죄자가 또다시 피해를 끼치지 못하도록 억제하고, 다른 사람들이 그 같은 행위를 하지 못하도록 예방하는 데 있을 뿐이다. 이는 범죄로 얻을 이득, 곧 공익이 입게 되는 그만큼의 손실보다 형벌이 가하는 손해가 조금이라도 크기만 하면 달성된다. 그리고 이러한 손익 관계를 누구나 알 수 있도록 처벌 체계는 명확히 성문법으로 규정되어야 하고, 그 집행의 확실성도 갖추어져야 한다. 결국 범죄를 ⓑ 가로막는 방벽으로 형벌을 바라보는 것이다. 이 ㉠ 울타리의 높이는 살인인지 절도인지 등에 따라 달리해야 한다. 공익을 훼손한 정도에 비례해야 하는 것이다. 그것을 넘어서는 처벌은 폭압이며 불필요하다. 베카리아는 말한다. 상이한 피해를 일으키는 두 범죄에 동일한 형벌을 적용한다면 더 무거운 죄에 대한 억지력이 상실되지 않겠는가. 그는 인간이 감각적인 존재라는 사실에 맞추어 제도가 운용될 것을 역설한다. 가장 잔혹한 형벌도 계속 시행되다 보면 사회 일반은 그에 ⓒ무디어져 마침내 그런 것을 봐도 옥살이에 대한 공포 이상을 느끼지 못한다. 인간의 정신에 ⓓ 크나큰 효과를 끼치는 것은 형벌의 강도가 아니라 지속이다. 죽는 장면의 목격은 무시무시한 경험이지만 그 기억은 일시적이고, 자유를 박탈당한 인간이 속죄하는 고통의 모습을 오랫동안 대하는 것이 더욱 강력한 억제 효과를 갖는다는 주장이다. 더욱 중요한 것을 지키기 위해 희생한 자유에는 무엇보다도 값진 생명이 포함될 수 없다고도 말한다. 이처럼 베카리아는 잔혹한 형벌을 반대하여 휴머니스트로, 최대 다수의 최대 행복을 말하여 공리 주의자로, 자유로운 인간들 사이의 합의를 바탕으로 논의를 전개하여 사회 계약론자로 이해된다. 형법학에서도 형벌로 되갚아 준다는 응보주의를 탈피하여 장래의 범죄 발생을 방지한다는 일반 예방주의로 나아가는 토대를 ⓔ 세웠다는 평가를 받는다",사회
"1993년 노벨 화학상은 중합 효소 연쇄 반응(PCR)을 개발한 멀리스에게 수여된다. 염기 서열을 아는 DNA가 한 분자라도 있으면 이를 다량으로 증폭할 수 있는 길을 열었기 때문이다. PCR는 주형 DNA, 프라이머, DNA 중합 효소, 4종의 뉴클레오 타이드가 필요하다. 주형 DNA란 시료로부터 추출하여 PCR 에서 DNA 증폭의 바탕이 되는 이중 가닥 DNA를 말하며, 주형 DNA에서 증폭하고자 하는 부위를 표적 DNA라 한다. 프라이머는 표적 DNA의 일부분과 동일한 염기 서열로 이루어진 짧은 단일 가닥 DNA로, 2종의 프라이머가 표적 DNA의 시작과 끝에 각각 결합한다. DNA 중합 효소는 DNA를 복제하는데, 단일 가닥 DNA의 각 염기 서열에 대응하는 뉴클레오타이드를 순서대로 결합시켜 이중 가닥 DNA를 생성한다. PCR 과정은 우선 열을 가해 이중 가닥의 DNA를 2개의 단일 가닥으로 분리하는 것으로 시작한다. 이후 각각의 단일 가닥 DNA에 프라이머가 결합하면, DNA 중합 효소에 의해 복제되어 2개의 이중 가닥 DNA가 생긴다. 일정한 시간 동안 진행되는 이러한 DNA 복제 과정이 한 사이클을 이루며, 사이클마다 표적 DNA의 양은 2배씩 증가한다. 그리고 DNA의 양이 더 이상 증폭되지 않을 정도로 충분히 사이클을 수행한 후 PCR를 종료한다. 전통적인 PCR는 PCR의 최종 산물에 형광 물질을 결합시켜 발색을 통해 표적 DNA의 증폭 여부를 확인한다. PCR는 시료의 표적 DNA 양도 알 수 있는 실시간 PCR라는 획기적인 개발로 이어졌다. 실시간 PCR는 전통적인 PCR와
동일하게 PCR를 실시하지만, 사이클마다 발색 반응이 일어나도록 하여 누적되는 발색을 통해 표적 DNA의 증폭을 실시간으로 확인할 수 있다. 이를 위해 실시간 PCR에서는 PCR 과정에 발색 물질이 추가로 필요한데, ‘이중 가닥 DNA 특이 염료’ 또는 ‘형광 표식 탐침’이 이에 이용된다. ㉠ 이중 가닥 DNA 특이 염료는 이중 가닥 DNA에 결합하여 발색하는 형광 물질로, 새로 생성된 이중 가닥 표적 DNA에 결합하여 발색하므로 표적 DNA의 증폭을 알 수 있게 한다. 다만, 이중 가닥 DNA 특이 염료는 모든 이중 가닥 DNA에 결합할 수 있기 때문에 2개의 프라이머끼리 결합하여 이중 가닥의 이합체(二合體)를 형성한 경우에는 이와 결합하여 의도치 않은 발색이 일어난다. ㉡ 형광 표식 탐침은 형광 물질과 이 형광 물질을 억제하는 소광 물질이 붙어 있는 단일 가닥 DNA 단편으로, 표적 DNA에서 프라이머가 결합하지 않는 부위에 특이적으로 결합하도록 설계된다. PCR 과정에서 이중 가닥 DNA가 단일 가닥으로 되면, 형광 표식 탐침은 프라이머와 마찬가지로 표적 DNA에 결합한다. 이후 DNA 중합 효소에 의해 이중 가닥 DNA가 형성되는 과정 중에 탐침은 표적 DNA와의 결합이 끊어지고 분해된다. 탐침이 분해되어 형광 물질과 소광 물질의 분리가 일어나면 비로소 형광 물질이 발색되며, 이로써 표적 DNA가 증폭되었음을 알 수 있다. 형광 표식 탐침은 표적 DNA에 특이적으로 결합하는 장점을 지니나 상대적으로 비용이 비싸다. 실시간 PCR에서 발색도는 증폭된 이중 가닥 표적 DNA의 양에 비례하며, 일정 수준의 발색도에 도달하는 데 필요한사이클은 표적 DNA의 초기 양에 따라 달라진다. 사이클의 진행에 따른 발색도의 변화가 연속적인 선으로 표시되며, 표적 DNA를 검출했다고 판단하는 발색도에 도달하는 데 소요된 사이클을 Ct값이라 한다. 표적 DNA의 농도를 알지 못하는 미지 시료의 Ct값과 표적 DNA의 농도를 알고 있는 표준 시료의 Ct값을 비교하면 미지 시료에 포함된 표적 DNA의 농도를 계산할 수 있다. PCR는 시료로부터 얻은 DNA를 가지고 유전자 복제, 유전병 진단, 친자 감별, 암 및 감염성 질병 진단 등에 광범위하게 활용된다. 특히 실시간 PCR를 이용하면 바이러스의 감염 여부를 초기에 정확하고 빠르게 진단할 수 있다.",과학
"[앞부분의 줄거리] 나는 기범이 죽기 전에 무슨 일이 있었는지 알기위해, 그가 살았던 구천동을 찾아간다. 기범의 행적을 잘 알고 있는 ‘임 씨’를 만나 사연을 듣기 전에, 일규의 장례식 후에 있었던 기범과의 과거 일을 회상한다.  “네가 일규를 어떻게 아냐? 네깐 게 뭘 안다구 감히 일규를 입에 올리냐?” 기범은 순간 잔을 던지고 미친 듯이 웃기 시작했다. 너무나 돌연한 웃음이어서 나는 그때 꽤나 놀랐다. 기범이 그처럼 미친듯이 웃는 것을 나는 그날 처음 보았다. “그래, 네 말이 맞다. 나는 그놈을 입에 올릴 자격이 없다. 허지만 누가 그놈을 진심으로 사랑한 줄 아냐? 너희냐? 너희가 그놈을 사랑한 줄 아냐?” ㉠나는 긴장했다. 그의 눈에서 번쩍이는 눈물을 보았기 때문이다. “너는 그놈이 아깝다구 했지만 나는 그놈이 죽어 세상 살맛이 없어졌다. 나는 살기가 울적할 때마다 허공에서 그놈의 쌍판을 찾았다. 나는 그놈을 통해서만 살아가는 재미와 기쁨을 느꼈다. 그러나 그놈 역시 사정은 나하구 똑같았다. 나를 발길로 걷어찼지만 그놈은 나를 잊은 적이 없다. 우리는 서로 사랑했지만 사랑하는 방법이 달랐을 뿐이다. (중략) “원래 그 사람은 도회지에서 살던 사람인데 왜 그때 도시를 버리구 깊은 산골을 찾았는지 모르겠군.” “처음엔 저두 많이 궁금하게 생각했습니다. 뭔가 세상에 죄를 짓구 숨어 사는 분이 아닌가 했습니다. ㉡더구나 이리루 들어오시자 머리를 깎구 수염까지 기르셨거든요. 그러나 오래 뫼시구 살다 보니 저대루 차츰 납득이 갔습니다. 한마디로 말하기는 어렵지만 세상에 뭔가 실망을 느끼신 게 아닌가 싶습니다.” “본인이 그런 말을 한 적이 있소?” “과거 얘기는 좀체 안 하시는 편이었는데 언젠가는 내게 그 비슷한 말씀을 하시더군요. 듣기에 따라서는 궤변 같지만 그분은 남하구 다른 ⓐ 묘한 철학을 지니구 계셨습니다.” “그걸 한번 들려줄 수 없소?” “그분은 세상이 어지럽구 더러울 때는 그것을 구하는 방법이 한 가지밖에 없다구 하셨습니다. 세상을 좀 더 썩게 해서 더 이상 그 세상에 썩을 것이 없도록 만들어야 한다는 것입니다. 그걸 썩지 않게 고치려구 했다가는 공연히 사람만 상하구 힘만 배루 든다는 것입니다. ㉢‘모두 썩어라, 철저히 썩어라’가 그분이 세상을 보는 이상한 눈입니다. 제 나름의 어설픈 추측입니다만 그분은 사람만이 지닌 이상한 초능력을 믿으시는 것 같았습니다. 사람은 온갖 악행에도 불구하고 자기 스스로를 송두리째 포기하지는 않는다는 것입니다. 세상이 철저히 썩어서 더 썩을 것이 없게 되면 사람은 살아남기 위해 언젠가는 스스로 자구책을 쓴다는 것입니다. 당신은 바로 그걸 믿으셨고, 이러한 자기 생각을 부정(不正)의 미학이라는 묘한 말루 부르시기두 했습니다.” 나는 순간 가슴 한구석에 뭔가가 미미하게 부딪쳐 오는 진동을 느꼈다. 진동의 진상은 확실치 않지만, 나는 그것이 기범을 이해하는 어떤 열쇠가 아닌가 생각했다. 그의 온갖 기행과 궤변들이 어지러운 혼란 속에서 그제야 언뜻 한 가닥의 질서 위에 어렴풋이 늘어서는 것이었다. “헌데 세상에 대해 그런 생각을 지닌 사람이 갑자기 왜 세상을 등지구 이런 산속에 박혀 사는 거요?” “당신께서 아끼시던 친구 한 분이 갑자기 세상을 버리셨다구 하시더군요. 그때 아마 충격을 받으시구 이리루 들어오신 게 아닌가 싶습니다.” “누구랍니까, 그 친구가?” “이름은 말씀 안 하시구 그분을 언제나 ‘미련한 놈’이라구만 부르셨습니다.” 오일규다. 나는 그제야 오일규의 장례식 후에 기범이 격렬하게 지껄인 저 시끄럽던 요설들이 생각났다. 어쩌면 기범은 그때 이미 세상을 등질 결심을 했는지도 알 수 없다. ㉣ 아니 그는 그 얼마 후에 내 앞에서 정말로 깨끗하게 사라져 버린 것이다. “그래 그 친구가 죽은 후로 왜 세상을 등졌답디까?” “세상 살 재미가 없어졌다구 하시더군요. 아마 친구분을 꽤나 좋아하셨던 모양입니다. 그 미련한 놈이 죽어 버렸으니 자기도 앞으로는 미련하게 살밖에 없노라구 하셨습니다. ㉤ 당신이 미련하다고 말씀하는 건 우습게 들리시겠지만 착한 일을 뜻하시는 것이었습니다.” “그래서 이곳에 온 후 사람이 갑자기 달라진 거요?” “전 그분의 과거를 몰라서 어떻게 달라졌는지는 잘 모릅니다. 허지만 이곳에 오신 후로는 그분은 거의 남을 위해서만 사셨습니다. 제가 생명을 구한 것두 순전히 그분의 덕입니다.” 나는 다시 기범이 지껄였던 과거의 ⓑ요설들이 생각난다. 세상을 항상 역(逆)으로만 바라보던 그의 난해성이 또 한 번 나를 혼란 속에 빠뜨린다. 그는 어쩌면 이 세상을 역순(逆順)과 역행(逆行)에 의해 누구보다 열심으로 가장 솔직하게 살다 간 것 같다. 그에게 악과 선은 등과 배가 서로 맞붙은 동위(同位) 동질(同質)의 것이었는지도 알 수 없다. 그는 악과 선 중 아무것도 믿지 않았고 오직 믿은 것이라고는 세상에는 아무것도 믿을 것이 없다는 사실뿐이었다. 그와 오일규가 맞부딪쳤을 때 오일규가 해체되는 것은 너무나 당연하다. 그것은 가장 비열한 삶이 가장 올바른 삶을 해체시키는 역설적인 예인 것이다. - 홍성원, ?무사와 악사? -",현대소설
