test,category
"선생님의 권유나 친구의 추천, 자기 계발 등 우리가 독서를 하게 되는 동기는 다양하다. 독서 동기는 ‘독서를 이끌어 내고, 지속하는 힘’으로 정의되는데, 이 정의에는 독서의 시작과 지속 이라는 두 측면이 포함되어 있다. 이러한 독서 동기는 슈츠가 제시한 ‘때문에 동기’와 ‘위하여 동기’라는 두 유형을 적용하여 설명할 수 있다. 독서의 ‘때문에 동기’는 독서 행위를 하게 만든 이유를 의미한다. 이는 독서 행위를 유발한 계기가 되므로 독서 이전 시점에 이미 발생한 사건이나 경험에 해당한다. 독서의 ‘위하여 동기’는 독서 행위를 통해 달성하고자 하는 목적을 의미한다. 그 목적은 독서 행위의 결과로 달성되므로 독서 이후 시점의 상태에 대한 기대나 예측이라는 성격을 가지며, 달성하지 못할 가능성을 내포한다. 예를 들어, 친구에게 책을 선물로 받아서 읽게 되었다고 할 때, 선물로 책을 받은 것은 이 독서 행위의 ‘때문에 동기’이다. 그리고 책을 읽고 친구와 책에 대해 대화를 나누는 것을 목적으로 설정했다면 이는 ‘위하여 동기’가 된다. 또한 독서 행위를 통해 성취감 이나 감동을 느끼는 것, 선물로 받은 책을 읽어서 친구를 실망시키지 않는 것 등도 이 독서 행위의 결과로 기대할 수 있는 것이므로 역시 ‘위하여 동기’가 된다고 할 수 있다. 이러한 동기 개념은 독서 습관의 형성 과정을 설명하는 데 도움이 된다. 성공적인 독서 경험의 핵심은 독서 행위를 통해 즐거움과 유익함을 경험하는 것인데, 이러한 경험을 하게 되면 다른 책을 더 읽고 싶다는 마음이 들고 그러한 마음은 새로운 독서 행위로 연결된다. 독서의 즐거움과 유익함은 새로운 독서 행위의 이유가 된다는 점에서 ‘때문에 동기’가 된다. 동시에, 새로운 독서 행위를 통해 다시 경험하고 싶어지는 ‘위하여 동기’가 되기도 한다. 이러한 선순환을 통해 독서 경험이 반복 되고 심화되면서 독서 습관이 자연스럽게 형성된다. 따라서 독서 습관을 형성하려면 ‘때문에 동기’와 ‘위하여 동기’를 바탕으로 우선 독서 행위를 시작하는 것과, 성공적인 독서 경험을 통해 독서 행위를 지속하는 것이 중요하다.",독서이론
"공포 소구는 그 메시지에 담긴 권고를 따르지 않을 때의 해로운 결과를 강조하여 수용자를 설득하는 것으로, 1950년대 초부터 설득 전략 연구자들의 연구 대상이 되었다. 초기 연구를 대표하는 재니스는 기존 연구에서 다루어지지 않았던 공포 소구의 설득 효과에 주목하였다. 그는 수용자에게 공포 소구를 세 가지 수준으로 달리 제시하는 실험을 한 결과, 중간 수준의 공포 소구가 가장 큰 설득 효과를 보인다는 것을 발견하였다. 공포 소구 연구를 진척시킨 레벤달은 재니스의 연구가 인간의 감정적 측면에만 ㉠치우쳤다고 비판하며, 공포 소구의 효과는 수용자의 감정적 반응만이 아니라 인지적 반응과도 관련된다고 하였다. 그는 감정적 반응을 ‘공포 통제 반응’,인지적 반응을 ‘위험 통제 반응’이라 ㉡불렀다. 그리고 후자가 작동하면 수용 자들은 공포 소구의 권고를 따르게 되지만, 전자가 작동하면 공포 소구로 인한 두려움의 감정을 통제하기 위해 오히려 공포 소구에 담긴 위험을 무시하려는 반응을 보이게 된다고 하였다. 이러한 선행 연구들을 종합한 위티는 우선 공포 소구의 설득 효과를 좌우하는 두 요인으로 ‘위협’과 ‘효능감’을 설정하였다. 수용자가 공포 소구에 담긴 위험을 자신이 ㉢겪을 수 있는 것이고 그 위험의 정도가 크다고 느끼면, 그 공포 소구는 위협의 수준이 높다. 그리고 공포 소구에 담긴 권고를 이행하면 자신의 위험을 예방할 수 있고 자신에게 그 권고를 이행할 능력이 있다고 느끼면, 효능감의 수준이 높다. 한 동호회에서 회원들 에게 ‘모임에 꼭 참석해 주세요. 불참 시 회원 자격이 사라집 니다.’라는 안내문을 ㉣보냈다고하자. 회원 자격이 사라진다는 것은 그 동호회 활동에 강한 애착을 가지고 있는 사람에게는 높은 수준의 위협이 된다. 그리고 그가 동호회 모임에 참석하는 일이 어렵지 않다고 느낄 때, 안내문의 권고는 그에게 높은 수준의 효능감을 주게 된다. 위티는 이 두 요인을 레벤달이 말한 두 가지 통제 반응과 관련지어 다음과 같은 결론을 도출하였다. 위협과 효능감의 수준이 모두 높을 때에는 위험 통제 반응이 작동하고, 위협의 수준은 높지만 효능감의 수준이 낮을 때에는 공포 통제 반응이 작동한다. 그러나 위협의 수준이 낮으면, 수용자는 그 위협이 자신에게 아무 영향을 ㉤주지않는다고 느껴 효능감의 수준에 관계없이 공포 소구에 대한 반응이 없게 된다. 이렇게 정리된 결론은 그간의 공포 소구 이론을 통합한 결과라는 점에서 후속 연구의 중요한 디딤돌이 되었다",사회
"분자들이 만나 화학 반응을 진행하는 데 필요한 최소한의 운동 에너지를 활성화 에너지라 한다. 활성화 에너지가 작은 반응은, 반응의 활성화 에너지보다 큰 운동 에너지를 가진 분자 들이 많아 반응이 빠르게 진행된다. 활성화 에너지를 조절하여 반응 속도에 변화를 주는 물질을 촉매라고 하며, 반응 속도를 빠르게 하는 능력을 촉매 활성이라 한다. 촉매는 촉매가 없을 때와는 활성화 에너지가 다른, 새로운 반응 경로를 제공한다. 화학 산업에서는 주로 고체 촉매가 이용되는데, 액체나 기체인 생성물을 촉매로부터 분리하는 별도의 공정이 필요 없기 때문 이다. 고체 촉매는 대부분 활성 성분, 지지체, 증진제로 구성된다. 활성 성분은 그 표면에 반응물을 흡착시켜 촉매 활성을 제공 하는 물질이다. 고체 촉매의 촉매 작용에서는 반응물이 먼저 활성 성분의 표면에 화학 흡착되고, 흡착된 반응물이 표면에서 반응하여 생성물로 변환된 후, 생성물이 표면에서 탈착되는 과정을 거쳐 반응이 완결된다. 금속은 다양한 물질들이 표면에 흡착될 수 있어 여러 반응에서 활성 성분으로 사용된다. 예를 들면, 암모니아를 합성할 때 철을 활성 성분으로 사용하는데, 이때 반응물인 수소와 질소가 철의 표면에 흡착되어 각각 원자 상태로 분리된다. 흡착된 반응물은 전자를 금속 표면의 원자와 공유하여 안정화된다. 반응물의 흡착 세기는 금속의 종류에 따라 달라진다. 이때 흡착 세기가 적절해야 한다. 흡착이 약하면 흡착량이 적어 촉매 활성이 낮으며, 흡착이 너무 강하면 흡착된 반응물이 지나치게 안정화되어 표면에서의 반응이 느려지므로 촉매 활성이 낮다. 일반적으로 고체 촉매에서는 반응에 관여하는 표면의 활성 성분 원자가 많을수록 반응물의 흡착이 많아 촉매 활성이 높아진다. 금속은 열적 안정성이 낮아, 화학 반응이 일어나는 고온에서 금속 원자들로 이루어진 작은 입자들이 서로 달라붙어 큰 입자를 이루게 되는데 이를 소결이라 한다. 입자가 소결되면 금속 활성 성분의 전체 표면적은 줄어든다. 이러한 문제를 해결하는 것이 지지체이다. 작은 금속 입자들을 표면적이 넓고 열적 안정성이 높은 지지체의 표면에 분산하면 소결로 인한 촉매 활성 저하가 억제된다. 따라서 소량의 금속으로도 ㉠금속을 활성 성분으로 사용하는 고체 촉매 의 활성을 높일 수 있다. 증진제는 촉매에 소량 포함되어 활성을 조절한다. 활성 성분의 표면 구조를 변화시켜 소결을 억제하기도 하고, 활성 성분의 전자 밀도를 변화시켜 흡착 세기를 조절하기도 한다. 고체 촉매는 활성 성분이 반드시 있어야 하지만 경우에 따라 증진제나 지지체를 포함하지 않기도 한다",과학·기술
"(가) 심리 철학에서 동일론은 의식이 뇌의 물질적 상태와 동일하 다고 ⓐ본다. 이와 달리 기능주의는 의식은 기능이며, 서로 다른 물질에서 같은 기능이 구현될 수 있다고 주장한다. 이때 기능 이란 어떤 입력이 주어졌을 때 특정한 출력을 내놓는 함수적 역할로 정의되며, 함수적 역할의 일치는 입력과 출력의 쌍이 일치함을 의미한다. 실리콘 칩으로 구성된 로봇이 찔림이라는 입력에 대해 고통을 출력으로 내놓는 기능을 가진다면, 로봇과 우리는 같은 의식을 가진다는 것이다. 이처럼 기능주의는 의식을 구현하는 물질이 무엇인지는 중요하지 않다고 본다. 설(Searle)은 기능주의를 반박하는 사고 실험을 제시한다. ‘중국어 방’ 안에 중국어를 모르는 한 사람만 있다고 하자. 그는 중국어로 된 입력이 들어오면 정해진 규칙에 따라 중국어로 된 출력을 내놓는다. 설에 의하면 방 안의 사람은 중국어 사용자와 함수적 역할이 같지만 중국어를 아는 것은 아니다. 기능이 같으 면서 의식은 다른 사례가 있다는 것이다. 동일론, 기능주의, 설은 모두 의식에 대한 논의를 의식을 구현하는 몸의 내부로만 한정하고 있다. 하지만 의식의 하나인 ‘인지’ 즉 ‘무언가를 알게 됨’은 몸 바깥에서 ⓑ일어나는 일과 맞물려 벌어진다. 기억나지 않는 정보를 노트북에 저장된 파일을 열람하여 확인하는 것이 한 예이다. 로랜즈의 확장 인지 이론은 이를 설명하는 이론이다. 그에 ⓒ따르면인지 과정은 주체에게 ‘심적 상태’가 생겨나게 하는 과정이다. 기억이나 믿음이 심적 상태의 예이다. 심적 상태는 어떤 것에도 의존함이 없이 주체에게 의미를 나타낸다. 예를 들어, 무언가를 기억하는 사람은 자기의 기억이 무엇인지 ⓓ알아보기위해 아무것에도 의존할 필요가 없다. 이와 달리 ‘파생적 상태’는 주체의 해석에 의존해서만 또는 사회적 합의에 의존해서만 의미를 나타내는 상태로 정의된다. 앞의 예에서 노트북에 저장된 정보는 전자적 신호가 나열된 상태로서 파생적 상태이다. 주체에 의해 열람된 후에도 노트북의 정보는 여전히 파생적 상태이다. 하지만 열람 후 주체에게는 기억이 생겨난다. 로랜즈에게 인지 과정은 파생적 상태가 심적 상태로 변환되는 과정이 아니라, 파생적 상태를 조작함으로써 심적 상태를 생겨 나게 하는 과정이다. 심적 상태가 주체의 몸 외부로 확장되는 것이 아니라, 심적 상태를 생겨나게 하는 인지 과정이 확장되는 것이다. 이러한 ㉠확장된 인지 과정은 인지 주체의 것일 때에만, 다시 말해 환경의 변화를 탐지하고 그에 맞춰 행위를 조절하는 주체와 통합되어 있을 때에만 성립할 수 있다 . 즉 로랜즈에게 주체 없는 인지란 있을 수 없다. 확장 인지 이론은 의식의 문제를 몸 안으로 한정하지 않고 바깥으로까지 넓혀 설명한다는 의의를 지닌다. (나) 일반적으로 ‘지각’이란 몸의 감각 기관을 통해 사물에 대해 아는 것을 의미한다. 이러한 지각을 분석할 때 두 가지 사실에 직면한다. 첫째, 그 사물과 내 몸은 물질세계에 있다. 둘째, 그사물에 대한 나의 의식은 물질세계가 아닌 다른 세계에 있다. 즉 몸으로서의 나는 사물과 같은 세계에 속하는 동시에 의식으로서의 나는 사물과 다른 세계에 속한다. 이에 대한 객관주의 철학의 입장은 두 가지로 나뉜다. 의식을 포함한 모든 것을 물질로 환원하여 의식은 물질에 불과하다고 주장하거나, 의식을 물질과 구분되는 독자적 실체로 규정함 으로써 의식과 물질의 본질적 차이를 주장한다. 전자에 의하면 지각은 사물로부터의 감각 자극에 따른 주체의 물질적 반응으로 이해되며, 후자에 의하면 지각은 감각된 사물에 대한 주체 즉 의식의 판단으로 이해된다. 이처럼 양자 모두 주체와 대상의 분리를 전제하고 지각을 이해한다. 주체와 대상은 지각 이전에 이미 확정되어 각각 존재한다는 것이다. 하지만 지각은 주체와 대상이 각자로서 존재하기 이전에 나타 나는 얽힘의 체험이다. 예를 들어 다른 사람과 손이 맞닿을 때 내가 누군가의 손을 ⓔ만지는동시에 나의 손 역시 누군가에 의해 만져진다. 감각하는 것이 동시에 감각되는 것이 되는 얽힘의 순간에, 나는 나와 대상을 확연히 구분한다. 지각이라는 얽힘의 작용이 있어야 주체와 대상이 분리될 수 있다. 다시 말해 주체와 대상은 지각이 일어난 이후 비로소 확정된다. 따라서 ㉡지각과 감각은 서로 구분되지 않는다 . 지각은 물질적 반응이나 의식의 판단이 아니라, 내 몸의 체험 이다. 지각은 나의 몸에 의해 이루어지는 것이고, 지각이 이루어 지게 하는 것은 모두 나의 몸이다",인문
"십여 일이 지날 무렵 노비 막동이 눈물을 흘리며 물었다. “낭군께선 늘 언행이 호방하시고 재주가 무리 중에 탁월해 거침없으시더니, 요즘에는 울적해 하시니 말 못할 근심이 있는 듯하옵니다. 사모하는 이라도 있으신지요?” 김생이 슬퍼하며 느낀 바를 사실대로 말하니 막동이 한참 생각하고 말했다. “소인이 낭군을 위해 마륵의 ㉠계책 을 올릴 테니, 낭군께선 애태울 일이 없으십니다.” “그게 무엇이더냐?” “낭군께선 급히 주효(酒肴)를 성대히 마련하시고 바로 미인이 머문 집으로 가셔서 손님을 전별(餞別)하려는 듯 하십시오. 방 하나를 빌려 잔치를 벌이시고 이놈을 불러 손님을 모셔 오라 하시면, 제가 명을 받들어 나갔다가 한 식경 후에 돌아와 ‘손님이 오십니다.’라 하지요. 낭군께서 다시 명하시면 제가 또 명을 받고 날이 저물 때쯤 돌아와, ‘손님께서 오늘은 송별 객이 많아 심히 취해 갈 수 없으니 내일 꼭 가겠노라 하셨습 니다.’라 하지요. 이때 낭군께선 주인을 불러 앉으라 하시고 그 주효를 먹게 하고, 기색을 드러내지 말고 물러나십시오. 다음 날도 그렇게 하고 그다음 날도 그렇게 하시면, 처음엔 고맙게 여길 것이요, 두 번째는 은혜에 감격할 것이며, 세 번째는 필히 의문을 품을 것입니다. 은혜를 느끼면 보답을 생각할 것이고, 은혜에 감격하면 죽음으로써 보답하고자 생각할 것이며, 의문이 생기면 하시고 싶은 바를 물어볼 것입니다. 이때 흉금을 털고 말하신다면 일은 거의 다 된 것입지요.” 생은 진정 그럴듯하다 여기고 기뻐하며 말했다. “내 일이 잘 되겠구나!” 생은 그 계책에 따라 즉시 주효를 갖추어서 곧바로 그 집에 가 전별 자리를 마련하였다. (중략) 생이 사모하는 이가 필시 이곳에 없는 줄 알고 낯빛을 바꾸며 말했다. “이 몸이 할멈에게 후의(厚意)를 입었으니 어찌 사실대로 말하지 않겠나? 과연 모월 모일 모처에서 오다가 길에서 마침 한 낭자를 보았다네. 나이는 대략 십오륙 세에 푸른 적삼에 붉은 치마를 입었고, 백릉버선에 자색 신을 신었지. 진주 비녀를 꽂고 새하얀 옥 반지를 끼고, 홍화문 앞길을 지나 가고 있었다네. 내 마음이 화사해지고 춘정을 이기지 못해 뒤따랐는데, 마지막에 이른 곳이 곧 할멈의 집이었네. 그날 이후로 마음이 혼미하여 만사가 흐릿하며, 오로지 그 낭자만 생각했다네. 맑은 눈동자와 하얀 이가 자나 깨나 잊히지 않아 상심하며 애태우길 하루 이틀이 아니었네. 할멈이 나를 보고 낯빛이 파리하다 했는데 왜 그랬겠나? 그래서 손님을 전별한 다며 할멈을 번거롭게 한 것이네.” 노파가 이 말을 듣고 몹시 애처로워했으나 생이 마음에 둔 사람이 누군지 몰랐다. 한동안 깊이 생각하다가 문득 깨닫고서 말했다. 6 20 “그런 애가 있습죠. 바로 죽은 제 언니의 딸이에요. 이름은 영영이고 자(字)는 난향이죠. 만약에 정말 그렇다면 참으로 어려운 일입니다. 참 어려운 일이에요!” “왜 그러한가?” “이 애는 회산군 댁 시비예요. 궁에서 나고 자라 문 앞길도 밟지 못한 지 오래랍니다. 자색(姿色)이 고운 것은 낭군께서 이미 보셨으니 굳이 말할 것 없지만 고운 마음이며 얌전한 몸가짐은 양반집 규수와 다를 게 없지요. 게다가 음률과 문장을 알아 나리께서 어여삐 여기시고 장차 소실(小室)로 맞으려 하셨지만, 부인의 시샘이 하동의 사자후보다 심하여 그렇게 못 하고 있을 뿐이옵니다. 지난번 그 애가 올 수 있었던 것은 한식 때를 맞아 그 애가 어미의 제사를 이곳에서 지내 려고 부인께 말미를 얻었기 때문이지요. 그리고 때마침 나리 께서 외출하신 터에 올 수 있었지 그렇지 않았던들 낭군께서 어찌 얼굴을 볼 수 있었겠습니까? 아이고! 낭군께서 다시 만나시기는 참으로 어렵습죠. 참으로 어려워요!” 생이 하늘을 우러러 탄식하며 말했다. “아, 끝난 것이로구나! 나는 필시 죽겠구나!” 노파가 안타까워 멍하니 서 있다가 다시 말했다. “딱 한 가지 ㉡방법이 있습죠. 단오가 꼭 한 달 남았습니다. 그때 이 몸이 죽은 언니를 위해 제사상을 차리고 부인께 영영에게 반나절의 말미를 주도록 청한다면, 만에 하나 낭군의 뜻을 이룰 수 있을 것입니다. 낭군께선 돌아가시어 때를 기다 렸다가 오시지요.” 생이 기뻐하며 말했다. “할멈 말대로 된다면야 인간의 5월 5일이 천상의 7월 7일이 되겠소!” 생과 노파는 각각 만복을 기원하며 헤어졌다.-작자 미상, ｢상사동기｣",고전산문
"(가) ㉠평생 에 원하느니 다만 충효뿐이로다 이 두 일 말면 금수(禽獸)나 다르리야 마음에 하고자 하여 ㉡십재 황황(十載遑遑)*하노라 비록 못 이뤄도 임천(林泉)이 좋으니라 무심 어조(魚鳥)는 절로 한가하였나니 조만간 세상일 잊고 너를 좇으려 하노라 출(出)하면 치군택민*처(處)하면 조월경운* 명철 군자는 이것을 즐기나니 하물며 부귀위기라가난하게살리로다 날이 저물거늘 도무지 할 일 없어 소나무 문을 닫고 달 아래 누웠으니 세상에티끌마음이일호말(一毫末)도없다 성현의 가신 길이 ㉢만고(萬古) 에 한가지라 은(隱)커나 현(見)커나 도(道)가어찌다르리 한가지 길이오 다르지 않으니 아무 덴들 어떠리 강가에 누워서 강물 보는 뜻은 세월이 빠르니 ㉣백세(百歲) 인들 길겠느뇨 ㉤십 년 전 진세(塵世) 일념이 얼음 녹듯 한다-권호문, ｢한거십팔곡｣ * 십재 황황: 십 년을 허둥지둥함. * 치군택민: 임금에게 충성하고 백성에게 혜택을 베풂. * 조월경운: 달 아래 고기 낚고 구름 속에서 밭을 갊. (나) [D] 몇 칸의 집을 수선하려 함에, 아내가 취서사로 들어가 겨릅*을 구해 오길 권하였다. 유택은 안 된다고 하고, 유평은 해 보자고 하는데, 나도 스스로 생각해 보니, 절은 기와를 쓰기에 겨릅은 그다지 아끼는 것이 아니고, 다만 민간의 요구와 요청에 응하는 것이기에, 이를 요구하더라도 의리를 심히 해치지 않을 듯하였다. 그래서 다시 의견을 널리 구해 보지 않았다. 마침 처숙부 상사공이 약을 지으려고 취서사로 가게 되었는데, 내가 가고자 함을 알고 따르게 하였다. 대개 공 또한 안 된다고 생각하지는 않았기 때문이다. 이윽고 취서사에 도착하니 근방 마을에서 모여든 자가 거의 승려들 수와 맞먹었는데, 모두 겨릅 때문에 온 자들이었다. 좌우 에서 낚아채 가며 많이 가지려 다투고, 시끌벅적하게뒤섞여 밟아 대어 곧 시장판을 만들었으며, 가져감이 많고 적음은 그 힘의 강약에 따랐으나 승려들은 참견하는 바가 없었다. 그런데 늦게 도착하여 종도 없는 자는 승려들을 나무라며, 심지어 가혹한 일을 하기까지 했지만 또한 얻을 수 없었다. (중략) 나는 마음속으로 민망히 생각하였지만, 이미 그 속에 가 있었 기에 의리를 이욕 <제1수> [A] <제3수> <제8수> [B] <제13수> [C] <제17수> <제19수> [E] 에 빼앗겨서 초연히 버리고돌아오지못하 였다. 상사공의 힘으로 수십 묶음을 얻어 햇빛에 말려 보관할 수 있었으니, 다 상사공의 도움 덕분이었다. 스스로 헛걸음하지 않은 것을 매우 다행스럽게 여겼는데, 집으로 돌아오자 멍하기가 마치 술에서 막 깨어난 사람이 잔뜩 취했을 때를 되짚어 생각하는 듯하였다. 내 아내는 비록 원대한 식견이 있는 사람은 아니지만, 내가 항상 곤궁함 때문에 치욕을 입을까 걱정하였으니, 가령 이와 같을 줄 알았다면 반드시 나의 행차를 권하지 않았을 것이고, 유평도 또한 마땅히 찬동하지 않았을 것이다. 상사공은 청렴하고 정직하여 주고받음이 구차하지 않다. 거처 하는 집 아래채가 세 칸의 초가집이니, 마땅히 겨릅이 필요하 였을 것이다. 그리고 막 삼계 서원 원장이 되었는데, 취서사가 바로 삼계 서원에 귀속된 절이었다. 그때 서원의 노비가 개인적 으로 취서사에 가서 머물고 있는 자가 서너 명 있었으니, 진실로 가지려고 하면 힘이 없을 걱정이 없었다. 그런데 담담하게 한 마디도 간섭함이 없었으니, 그 마음속으로 반드시 나를 비난하 였을 것이다. 그런데도 애써 나를 위하여 저와 같이 마음과 힘을 써 주신 것은 다만 나의 곤궁함을 불쌍히 여겨서일 뿐이 리라. 맹자는 “궁해도의(義)를잃지않는다.” 하였고, 이극은 “궁할 때에 그 해서는 안 될 일을 살펴본다.”하였다. 나는 궁함 때문에 이미 스스로 의를 잃어서 평소에 하지 않던 행동을 했고, 또 어른에게까지 폐를 끼쳤으니 참으로 부끄러워할 일이다. 이미 뉘우칠 줄 알았으니, 이후에는마땅히조심해야겠기에 이를 갖추어 기록하고, 또 유택이 나를 아껴 약이 되는 유익한 말을 했음을 드러낸다. *겨릅: 껍질을 벗긴 삼대-김낙행, ｢기취서행｣",갈래복합
