test,category
"[앞부분 줄거리] 아버지가 위독하다는 소식을 듣고 귀향한 정일은 용팔에게 재산 상속에 관한 이야기를 듣는다. 아버지가 아직도 지키고 있는 그의 재산을 넘겨다보는 듯한 용팔이가 따지는 산판알이 거침없이 한 자리씩 올라가는 것을 유심히 바라보고 있는 자신을 의식하며 보고 있을 때, 이렇게 대강만 놓아도, 하고 산판을 밀어 놓으며 쳐다보는 용팔의 눈과 마주치게 되자 정일이는 흠칫 놀라게 되는 자신의 얼굴이 붉어 지는 것을 깨달았다. ⓐ여기 대한 상속세만 해도 큰돈인데 안 물고 할 수 있는 이것은 제 말씀대로 하시지요. [A] 이렇게 결정적 으로 말하는 용팔이는 정일이의 앞에 위임장을 내놓으며 도장을 치라고 하였다. 정일이는 더욱 불쾌하여졌다. 잠이 부족한 신경 탓도 있겠 지만 자기의 눈을 기탄없이 바라보는 용팔이의 얼굴에 발라 놓은 듯한 그 웃음이 말할 수 없이 미웠다. 이 소인 놈! 하는 의분 같은 ㉠심열이 떠오르며, 언제 내가 이런 음모를 하자고 너와 공모를 하였던가? 하고 그의 뺨을 갈기고 싶은 충동을 느끼었다. 그러나 정일이는 금시에 미끄러지는 듯한 웃음이 자기 얼굴에 흐름을 깨달았다. 이러한 심열은 신경 쇠약의 탓이 아닐까? 의분이랄 것도 없고 결벽성도 아니고 그런 것을 공연히 이같이 한순간에 뒤집히는 자기 마음 한 모퉁이에 상식을 농쳐 뿌린 결과가 어떤가? 해 보자 하는 놓치기 쉬운 어떤 힌트같이 번쩍이는 생각을 보자 정일이는 조급히 도장을 뒤져내며, 자 칠 대로 치우, 나는 어디다 치는 것도 모르니까 하였다. 이렇게 지껄이듯이 말하는 정일이는 자기가 실없이 웃기까지 하는 것을 들을 때 내가 지금 더 심한 심열에 떠 있지 않은가? 하는 생각에 갑자기 말과 웃음과 표정까지 없어지고 말았다. ⓑ도장을 치고 난 용팔이는 공손히 정일이에게 돌리며, 잔금은 제가 장인께 말씀드리겠습니다, 하고 일어선다. 중문으로 들어 가는 용팔이의 뒷모양을 바라보던 정일이는 갑자기 불러내고 싶었다. 궁둥이를 들먹하고 부르는 손짓까지 하였으나 탄력 없이 벌어진 입에서는 말이 나오지 않았다. 창졸간에 용팔이를 어떻게 불러야 할지 몰라서 주저되는 것같이도 생각되었다. 중문 안으로 들어가는 용팔이의 뒷모양은 마치 심한 장난을 꾸미다가 용기를 못 내는 자기를 남겨 두고 ⓒ그걸 못 해? 내 하마 하고 나서는 동무의 모양같이 아슬아슬한 것이었다 . 종시 용팔이가 중문 안으로 사라져서 불러낼 기회를 놓치고 말았 다고 후회하면서도 내가 정말 후회하는 것이라면 지금이라도 따라가서 붙들 수도 있지 않은가? 이렇게 생각하는 정일이는 용팔이가 이 말을 시작하였을 때부터 자기는 육감으로 벌써 예기하였던지도 모를 일이 지금 일어나리라는 기대가 앞서는 것을 느끼며 ⓓ정일이는 실험의 결과를 기다리는 듯이 숨을 죽이고 귀를 기울이고 있었다 . 예사로운 말소리는 들리지 않는 거리이므로 긴장한 정일이의 귀에도 한참 동안은 아무런 말도 들리지 않았다. 아버지도 종시 죽음에 굴복하고 마는가? 이렇게 생각되어 정일이는 긴장하였더니만큼 허전한 실망에 담배를 붙이려고 성냥을 그었을 때 자기의 귀를 때리는 듯한 아버지의 격분한 고함 소리를 들었다. 10 20 (중략) 사실 이렇게 되어서까지도 죽기가 싫은가 하고 아버지를 눈 찌푸리고 바라보는 자기는 죽음의 공포를 해탈한 무슨 수양이 있는 것이 아니라 단지 애써 살려는 의지력이 없는 것뿐이다. ⓔ아버지는 한 번도 자기의 생활을 회의하거나 죽음을 생각할 필요가 없었던 사람이므로 이같이 죽음과 싸울 수 있는 것이 아닐까 생각하였다. 그래서 정일이는 어떤 위대한 의지력을 우러러보는 듯한 마음으로 아버지의 고통을 바라보고 있는 자기를 발견하는 때가 있었다. 그때 심한 구토를 한 후부터 한 방울 물도 먹지 못하고 혓바닥을 축이는 것만으로도 심한 구역을 하게 된 만수 노인은 물을 보기라도 하겠다고 하였다. 정일이는 요를 둑여서 병상을 돋우고 아버지가 바라보기 편한 곳에 큰 물그릇을 놓아 드렸다. 그러나 그 물그릇을 바라보기에 피곤한 병인은 어디나 눈 가는 곳에는 물이 보이기를 원하 였다. 그래서 큰 어항을 병실에 가득 늘어놓고 물을 채워 놓았다. 병인은 이 어항에서 저 어항으로 ㉡서늘한 감각 [B] 을 시선으로 핥듯이 돌려 보다가 그도 만족하지 못하여 시원히 흐르는 물이 보고 싶다고 하였다. 정일이는 아버지가 보기 편한 곳에 큰 물그릇을 놓고 대접으로 물을 떠서는 작은 폭포같이 들이 쏟고 또 떠서는 들이 쏟기를 계속하였다. 만수 노인은 꺼멓게 탄 혀를 벌린 입 밖에 내놓고 황홀한 눈으로 드리우는 물줄기를 바라보고 있었다. 그 눈을 볼 때 정일이는 걷잡을 사이도 없이 자기 눈에 눈물이 솟아 오름을 참을 수가 없었다. 정일이는 일찍이 그러한 눈을 본 기억이 없다고 생각하였다. 더욱이 아버지의 얼굴에서! 자기 아버지에게서 저러한 동경에 사무친 황홀한 눈을 보게 되는 것은 의외라고 할밖에 없었다.-최명익, ｢무성격자｣",현대소설
"(가) 만년(萬年)을 싸늘한 바위를 안고도 뜨거운 가슴을 어찌하리야 어둠에 창백한 꽃송이마다 깨물어 피터진 입을 맞추어 마지막 한방울 피마저 불어 넣고 해돋는 아침에 죽어가리야 사랑하는 것 사랑하는 모든 것 다 잃고라도 흰뼈가 되는 먼 훗날까지 그 뼈가 부활하여 다시 죽을 날까지 거룩한 일월(日月)의 눈부신 모습 임의 손길 앞에 나는 울어라. 마음 가난하거니 임을 위해서 내 무슨 자랑과 선물을 지니랴 의로운 사람들이 피흘린 곳에 솟아 오른 대나무로 만든 피리뿐 흐느끼는 이 피리의 아픈 가락이 구천(九天)에 사모침을 임은 듣는가. 미워하는 것 미워하는 모든 것 다 잊고라도 붉은 마음이 숯이 되는 날까지 그 숯이 되살아 다시 재 될 때까지 못 잊힐 모습을 어이 하리야 거룩한 이름 부르며 나는 울어라.-조지훈, ｢맹세｣ (나) 저기 저 담벽, 저기 저 라일락, 저기 저 별, 그리고 저기 저 우리 집 개의 똥 하나, 그래 모두 이리 와 ㉠내 언어 속에 서라 . 담벽은 내 언어의 담벽이 되고, 라일락은 내 언어의 꽃이 되고, 별은 반짝이고, 개똥은 내 언어의 뜰에서 굴러라. ㉡내가 내 언어에게 자유를 주었으니너희들도 자유롭게 서고, 앉고, 반짝 이고, 굴러라. 그래 봄이다. 봄은 자유다. 자 봐라, 꽃피고 싶은 놈 꽃피고, 잎 달고 싶은 놈 잎 달고, 반짝이고 싶은 놈은 반짝이고, 아지랑이고 싶은 놈은 아지랑이가 되었다. ㉢봄이 자유가 아니라면 꽃피는 지옥 이라고 하자. 그래 봄은 지옥이다. ㉣이름이 지옥이라고 해서 필 꽃이 안 피고, 반짝일 게 안 반짝이던가. 내 말이 옳으면 자, ㉤자유다 마음대로 뛰어라 . 11 20-오규원, ｢봄｣",현대시
"안녕하세요? ○○고 학생 여러분, 문화 해설사 □□□입니다. 한글 창제 이야기는 이미 잘 알고 계실 테니, 오늘은 한글 대중화에 힘쓴 두 인물에 대해 말씀드리죠. (목소리를 높여) 바로 주시경, 최현배 선생입니다. 역사적으로 암울했던 시기에 한글을 교육하고 연구하는 데 앞장선 두 분은 특별한 관계이기도 한데요. 어떤 관계일까요? 강연 내용에 힌트가 있으니 끝까지 잘 들어 주시길 바랍니다. (한 손을 올렸다 내리며) “말이 오르면 나라도 오르고, 말이 내리면 나라도 내리나니라.”나라와 민족을 지키기 위해 한글 교육과 연구에 매진했던 주시경 선생이 남긴 말씀입니다. 선생은 한글을 가르칠 수 있다면 어디든 마다하지 않고 책 보따리를 들고 다녔기에 ‘주 보따리’로 불렸다고 합니다. 이런 열정으로 국어 강습소를 개설했고, 여기에서 배출한 제자들과 함께 국어 연구 학회를 설립하였는데 이는 오늘날 한글 학회의 뿌리가 됩니다. 대표 저서로는 󰡔국어 문법󰡕, 󰡔국어문전음학󰡕, 󰡔국문 초학󰡕 등이 있습니다. 그리고 얼마 전 주시경 선생에 대한 다큐멘터리가 방영되었는데, 이 영상을 찾아보는 것도 도움이 될 것입니다. 다음 소개할 인물은 최현배 선생입니다. 선생은 국어 강습소에 다니며 만난 어떤 인물로부터 큰 영향을 받게 됩니다. 이쯤에서 주시경 선생과의 관계를 눈치채신 분도 있을 텐데요. (청중의 반응을 살피며) 맞습니다. 두 분은 사제 간입니다. 최현배 선생은 스승의 길을 따라 한글 교육과 연구에 전념합니다. 조선어 학회 사건에 연루되어 옥고를 치르는 중에도 검열을 피해 솜옷 속에 쪽지를 숨겨 놓으며 한글을 연구했다는 이야기는 선생의 굳은 의지를 잘 보여 주죠. 대표 저서로는 󰡔우리말본󰡕과 󰡔한글갈󰡕이 있습니다. 아, ‘갈’이 무슨 뜻인지 잘 모르실 텐데, 연구를 의미 하는 우리말입니다. 선생은 해방 후에 국어 교재 집필과 교원 양성에 힘썼습니다. 최현배 선생에 대한 자료는 △△기념관 누리집에서 찾으실 수 있습니다.",화법
"(가) 사회자: 오늘 토론의 논제는 ‘규격화된 초보 운전 표지 부착을 의무화해야 한다.’입니다. 먼저 찬성 측 입론해 주십시오. 찬성1: 얼마 전 초보 운전자의 운전 미숙으로 인해 교통사고가 연이어 발생하면서 초보 운전 표지 의무화에 대한 논의가 본격화되고 있습니다. 현행법에서 초보 운전자는 면허 취득 일을 기준으로 정의하는데 이것으로는 면허 취득자의 실제 운전 여부를 파악하기 어렵습니다. 따라서 이번 토론에서는 관련 연구들을 참고하여 초보 운전자를 ‘자동차 보험 가입 경력 기준 1년 미만자’로 정의하여 입론하겠습니다. 초보 운전자는 운전이 서툴기 때문에 사고 위험이 높을 수밖에 없습니다. 초보 운전자의 사고율이 전체 운전자의 평균에 비해 18%p높다는 통계도 있습니다. 교통사고는 안전과 직결되는 문제이며 생명을 위협할 수 있으므로 일본 에서는 1970년대부터 초보 운전 표지 의무 부착 제도를 시행 하고 있습니다. 표지를 의무화하여 초보임을 알리는 것은 초보 운전자를 보호할 뿐 아니라 모두의 안전을 위해 반드시 필요합니다. 한편 표지의 내용과 형식을 자율에 맡겨 발생하는 문제도 있습니다. 저는 최근에 ‘초보인데 보태 준 거 있어?’라는 표지를 커다랗게 붙인 차를 봤습니다. 이는 다른 운전자의 불쾌감을 유발하고 또 운전자의 후방 시야를 가려 안전 운전에 방해가 되기 때문에 표현의 자유라는 이유로 정당 화될 수 없습니다. 따라서 국가 차원에서 예산을 들여 규격 화된 표지를 제작하고 배부해 초보 운전자가 이를 의무적 으로 부착하게 해야 합니다. 사회자: 이어서 반대 측에서 반대 신문해 주십시오. 반대2: 질문에 앞서 방금 찬성 측이 한 발언은 표지 규격화가 표현의 자유를 침해한다는 점을 인정한 것으로 보입니다. 그럼 질문을 드리겠습니다. ㉠초보 운전자 사고율에 대한 통계의 정확한 출처를 알 수 있을까요? 찬성1: 2022년 국회 입법 조사처에서 발표한 자료입니다. 반대2: ㉡그 자료에서처럼 초보 운전자의 운전 미숙이 사고의 주요 원인이라면 표지 부착 의무화로 사고가 감소할까요? 찬성1: 경력 운전자들이 도로 위에서 초보 운전자를 확인하게 되면 이들을 배려하는 태도로 운전할 수 있습니다. 이를 통해 초보 운전자의 사고 위험을 감소시킬 수 있으리라 생각합니다. 반대2: 배려하는 태도, 중요하죠. 그런데 ㉢일부 경력 운전자 들이 표지를 부착한 초보 운전자에 대해 위협 운전을 할 수도 있지 않습니까? 찬성1: 표지를 보고 위협 운전을 하는 것은 제도로 인한 문제가 아니라 잘못된 운전 문화로 인해 발생한 문제입니다. 그러나 잘못된 운전 문화 역시 표지 부착 의무화를 통해서 바로 잡을 수 있다고 생각합니다. 반대2: 저희도 운전 문화 개선은 필요하다고 생각하지만 의무 화로 해결될 문제는 아니라고 봅니다. 그리고 표지를 규격 화해 제작하고 배부하려면 국가의 예산이 소요됩니다. ㉣이 제도를 도입할 경우 비용이 발생할 텐데 결국 득보다 실이 더 크지 않을까요? 찬성1: 안전과 생명은 무엇보다 중요한 가치이기 때문에 비용의 측면으로만 따질 문제는 아니라고 생각합니다. 반대2: ㉤표지 의무화는 제재를 가한다는 뜻인데, 위반자를 적 발하는 등 제도를 운영하는 것이 현실적으로 가능할까 요? 찬성1: (잠시 생각한 후) 구체적인 방법은 아직 생각해 보지 못했습니다. 사회자: 이어서 반대 측 입론해 주십시오. (나) [A] 이번 토론의 논제를 보고 나도 내년이면 면허를 취득할 수 있는 나이가 된다는 생각에 관심이 생겨 토론에 참여하기로 했다. 나는 반대 입장을 선택한 후 친구와 한 팀이 되어 토론을 준비했다. 먼저 쟁점을 분석한 후 주장할 내용을 정리하였다. 다음 날에는 근거 자료를 마련하려고 인터넷에서 자신의 개성을 자유 롭게 표현하고 있는 다양한 초보 운전 표지 사진들을 찾아 저장 했다. 그리고 ‘초보 스티커, 되레 난폭 운전자들의 표적’이라는 제목의 표지 부착 부작용 사례를 다룬 인터넷 신문 기사를 수집 했다. 이후 관련 기관에 메일로 자료를 요청하여 운전 행태, 교통안전 등을 평가해 수치화한 교통 문화 지수가 운전자의 인식 개선을 위한 다양한 활동을 통해 매년 꾸준히 상승하고 있다는 보도 자료를 받았다. 그다음 날에도 자료를 찾으러 친구와 함께 도서관에 갔다. 미국 대다수의 주에서는, 표지 부착은 의무화하지 않으면서 임시 면허 기간을 두어 초보 운전 자의 운전 숙련도를 높이는 단계적 운전면허 제도를 시행하고 있다는 논문 자료를 찾았다. 그리고 초보 운전자 대부분이 표지를 부착하고 있다는 설문 결과도 찾아 스크랩했다. 막상 토론을 하려니 평소 사람들 앞에서 말할 때 긴장해서 말을 더듬는 편이라 걱정이 되었다. 이를 극복하기 위해 실전 처럼 말하는 연습을 반복했고 그 덕분에 토론에서 침착하게 말할 수 있었다. 한편 토론 후 상호 평가를 해 보니, 친구는 준비한 자료를 활용해 논리적으로 답변한 반면 나는 찬성 측 반론을 미흡하게 반박한 것 같아 조금 아쉬웠다. 이번 토론을 준비하며 생각보다 많은 시간과 노력이 든다는 것을 알았다. 논제에 대한 찬성과 반대의 자료를 모두 조사해야 하기 때문이다",화법과 작문
"(가)학교신문의일부 (나)<2편>의초고 학교는 학생들이 집 다음으로 오랜 시간 생활하는 공간으로 제2의 집이라 할 수 있다. 그런데 학교를 생각하면 네모난 교실에서 칠판을 향해 앉아 있는 학생들이 떠오른다. 학교는 학습 기능을 수행하는 효율적 공간임에 틀림없지만, 지적 성장을 위한 공간뿐만 아니라 정서적 안정과 사회적 성장을 위한 공간도 필요하다. 하지만 우리 학교는 학습을 위한 공간에 집중되어 있어 아쉽다. 그래서 3층과 4층에서 현재 사용하지 않는 서편 끝 교실을 새롭게 바꿀 것을 제안한다. 먼저 학교에서 가장 높은 곳에 있으며 바깥 풍경이 아름답고 조용한 4층 교실을 ‘사색의 방’으로 만들었으면 한다. 이곳은 통창을 설치해 산과 하늘을 볼 수 있도록 하고 창가 의자에 앉아 쉬며 사색할 수 있는 공간으로 바꾼다. 창을 통해 자연을 느끼며 안정을 찾고 성찰의 시간을 보낼 수도 있다. 이 공간은 15 20 로그인/회원가입 필요없는 무료 입시 자료 사이트 레전드스터디 닷컴! LegendStudy.com 4 (화법과 작문) 집기로 채우지 않고 편안한 음악 소리로 채우되, 인공조명은 최소화한다. 마음을 다독일 수 있는 이 방은 정서적 안정을 위한 곳으로서 학생들이 머물고 싶은 공간이 될 것이다. 3층 교실은 ‘어울림의 방’으로 만들었으면 한다. 이곳은 교실과 복도 사이의 벽을 없애 누구나 드나들기 쉽도록 한다. 또 바닥은 자유롭게 앉거나 누워 즐겁게 이야기할 수 있는 공간으로 바꾼다. 모퉁이 공간을 활용하여 친한 친구들끼리 소모임을 할 수 있도록 하면 서로의 고민을 터놓을 수도 있다. 친구들과 어울 리며 관계를형성하는 이 방은 사회적 성장을 위한 곳으로서 학생들이 또 오고 싶은 공간이 될 것이다. 학생들이 바라는 이런 공간이 우리 학교에 생긴다면 학교 생활이 얼마나 행복할까? 정서적 안정과 사회적 성장을 위한 학교 공간의 조성으로 나의 생각은 커가고 친구들과 어울리며 행복을 느낄 수 있을 것이다. 이런 변화는 학업에도 더욱 열중할 수 있는 동력이 되며 학교에 대한 자부심도 느끼게 할 것이다",작문