T,Q,C,A
"흔히 읽기는 듣기․말하기와 달리 영․유아가 글자를 깨치고 나서야 시작된다고 생각한다. 그러나 대부분의 읽기 발달 연구 [A] 에서는 그 전에도 읽기 발달이 진행된다고 본다. 이 연구들에서는 읽기 행동의 특성이나 글에 대한 이해 수준 등에 따라 읽기 발달 단계를 위계화한다. 대개 ‘읽기 준비’를 하나의 단계로 보고, 이후의 단계를 ‘글자를 익히고 소리 내어 읽기’, ‘의미를 이해하며 읽기’, ‘학습 목적으로 읽기’, ‘다양한 관점으로 읽기’, ‘의미를 재구성 하며 읽기’의 순으로 나눈다. 여기서 읽기 준비 단계는 읽기의 기초가 형성되는 중요한 시기 이다. 이 시기의 영․유아는 글자를 깨치지는 못하더라도 글자의 형태에 익숙해지며, 글자와 소리의 대응 관계도 어렴풋이 알게 된다. 이 과정에서 글자가 뜻이 있고 음성으로 표현된다는 것을 알게 되는 유의미한 경험을 한다. 이 연구들에 따르면 ㉠읽기 준비 단계에서 영․유아의 읽기 발달은 타인의 읽기 행위를 관찰하고 글자에 대한 다양한 경험을 쌓으며 진행된다. 영․유아는 타인의 책 읽는 모습을 보며 글의 시작 부분, 글자를 읽는 방향, 책장을 넘기는 방식 등을 알게 된다. 읽어 주는 사람의 표정이나 몸짓을 기억해 모방하기도 한다. 의사소통의 각 영역인 듣기․말하기․읽기․쓰기는 서로 영향을 주며 함께 발달한다. 글자를 모르는 영․유아가 책을 넘기며 중얼거리고 책 읽는 흉내를 내는 것, 책 읽는 소리를 들으며 따라 말하는 것, 들은 단어나 구절을 사용해 문장을 지어 말하는 것, 읽어 주는 것을 들으며 그림이나 글자 형태로 끄적 거리는 것이 이에 해당한다. 읽기 발달은 일정한 시기에 급격히 이루어지는 것이 아니라 글자를 깨치기 이전부터 점진적으로 진행된다. 따라서 이 시기에 생활 속에서, 책을 자주 읽어 주며 생각을 묻는 등 의사소통의 각 영역이 같이 발달할 수 있도록 하는 자연스러운 지도가 읽기 발달에 도움을 준다. 읽기 준비 단계에서의 경험은 이후의 단계에 중요한 영향을 미친다","1. 대부분의 읽기 발달 연구의 내용과 일치하지 않는것은? ① 의미를 재구성하며 읽는 단계는 읽기 발달의 마지막 단계이다. ② 영․유아의 의사소통 각 영역은 상호 간의 작용 없이 발달한다. ③ 영․유아는 글자와 소리가 관계를 맺고 있다는 것을 막연하게 알게 된다. ④ 읽기 행동의 특성이나 글에 대한 이해 수준 등에 따라 읽기 발달의 단계를 나눈다. ⑤ 글자를 습득하고 소리 내어 읽는 단계는 학습을 목적으로 읽는 단계에 선행한다. 2. ㉠에 대한 이해로 적절하지 않은것은? ① 타인이 책을 읽어 줄 때 들었던 구절을 사용하여 말하는 행동이 관찰된다. ② 책에서 글이 시작되는 부분을 찾거나 일정한 방향으로 글자를 보는 행위가 관찰된다. ③ 글에 나타난 여러 단어의 뜻을 명확히 알고 소리 내어 글자를 읽는 행동이 관찰된다. ④ 책 읽어 주는 것을 들으며 그림이나 글자와 비슷한 형태로 나타내는 행위가 관찰된다. ⑤ 책을 볼 때 부모가 손가락으로 짚어 가며 읽어 준 행동을 기억하여 유사한 행동을 하는 것이 관찰된다. 3. [A]와 <보기>를 비교한 내용으로 가장 적절한 것은? [3점] <보 기> 읽기 지도는 신체적, 정신적으로 어느 정도 성숙한 이후에 해야 한다. 그 전에는 읽기 지도를 하지 않는 것이 바람직하다. 듣기․말하기와 달리 읽기 발달은 글자를 읽을 수 있는 기초 기능을 배운 후부터 시작되기 때문이다. 따라서 듣기와 말하기를 먼저 가르친 후 읽기, 쓰기의 순으로 가르치는 것이 효과적이다. ①[A]와 달리 <보기>는 일상에서의 자연스러운 읽기 지도를 강조하는군. ②[A]와 달리 <보기>는 글자를 깨치기 전의 경험이 읽기 발달에 영향을 준다고 보는군. ③[A]와 달리 <보기>는 글자 읽기의 기초 기능을 배운 후부터 읽기 발달이 시작된다고 보는군. ④[A]와 <보기>는 모두 읽기 이후에 쓰기를 가르쳐야 한다고 강조하는군. ⑤[A]와 <보기>는 모두 신체적, 정신적으로 어느 정도 성숙한 이후에 읽기를 가르치는 것이 효과적이라고 보는군",독서이론,86.6
"교통 이용 내역과 같은 기록은 개인의 데이터이며, 그 개인이 ‘정보 주체’이다. 데이터는 물리적 형체가 없고, 복제와 재사용이 수월하다. 이 데이터가 대량으로 집적․처리되면 빅 데이터가 되고, 이것의 정보 처리자인 기업 등이 ‘빅 데이터 보유자’이다. 산업 분야의 빅 데이터는 특정한 목적으로 활용될 수 있다는 점에서 경제적 가치를 지닌다. 데이터를 재화로 보아 소유권이 누구에게 귀속되어야 하는지에 대한 논의가 있다. 소유권의 주체를 빅 데이터 보유자로 보는 견해와 정보 주체로 보는 견해가 있다. 전자는 빅 데이터 보유자 에게 소유권을 부여하면 빅 데이터의 생성 및 유통이 ⓐ쉬워져 데이터 관련 산업이 활성화된다고 주장한다. 후자는 정보 생산 주체는 개인인데, 빅 데이터 보유자에게 부가 집중되는 것은 부당하므로, 정보 주체에게도 대가가 주어져야 한다고 본다. 최근에는 논의의 중심이 데이터의 소유권 주체에서 데이터에 접근하기 위한 방안으로서의 데이터 이동권으로 바뀌고 있다. 우리나라는 데이터에 대해 소유권이 아닌 이동권을 법으로 명문화 하여 정보 주체의 개인 정보 자기 결정권을 강화하였다. 데이터 이동권이란 정보 주체가 본인의 데이터를 보유한 자에게 데이터 이동을 요청하면, 그 데이터를 본인 혹은 지정한 제3자에게 무상으로 전송하게 하는 권리이다. 다만, 본인의 데이터라도 빅 데이터 보유자가 수집하여, 분석․가공하는 개발 과정을 거쳐 새로운 가치가 생성된 것은 이에 해당되지 않는다. 법제화 이전 에도 은행 간에 계좌 자동 이체 항목을 이동할 수 있는 서비스는 있었다. 이는 은행 간 약정에 ⓑ따라부분적으로 시행한 조치 였다. 데이터 이동권의 도입으로 쇼핑몰 상품 소비 이력 등 정보 주체의 행동 양상과 관련된 부분까지 정보 주체가 자율적으로 통제ㆍ관리할 수 있는 범위가 확대되었다. 데이터 이동권의 법제화로 기업은 데이터의 생성 비용과 거래 비용을 줄일 수 있다. 생성 비용은 기업 내에서 데이터를 개발할 때 발생하는 비용으로, 기업이 스스로 데이터를 수집할 때보다 전송받은 데이터를 복제 및 재사용하게 되면 절감할 수 있다. 거래 비용은 경제 주체 간 거래 시 발생하는 비용 으로, 계약 체결이나 분쟁 해결 등의 과정에서 생긴다. 그런데 데이터 이동권의 법제화로, ㉮정보 주체가 지정하여 데이터를 [B] 전송받게 된 기업은 ㉯정보 주체의 데이터를 보유했던 기업 으로부터 데이터를 받으면 비용을 절감할 수 있다. 이에 따라 기업 간 공유나 유통이 촉진되고, 관련 산업이 활성화된다. 한편, 정보 주체가 보안의 신뢰성이 높고 데이터 제공에 따른혜택이 많은 기업으로 데이터를 이동하면, 데이터가 집중되어 데이터의 공유나 유통이 위축될 수 있다는 우려도 있다. ㉰데이터 보유량이 적은 신규 기업은 기존 기업과 거래를 통해 데이터를 수집하는 것이 데이터 생성 비용 절감 에도 효율적이다. 그런데 ㉱데이터가 집중된 기존 기업이 집적․처리된 데이터를 공유하려 하지 않으면, 신규 기업의 시장 진입이 어려워져 독점화가 강화될 수 있다.","4. 윗글의 내용과 일치하지 않는것은? ① 데이터는 재사용할 수 있으며 물리적 형체가 없다. ② 교통 이용 내역이 집적․처리되면 경제적 가치를 지닌 데이터가 될 수 있다. ③ 우리나라 현행법에는 정보 주체에게 데이터의 소유권을 인정 하는 규정이 있다. ④ 정보 주체의 데이터로 발생한 이득이 빅 데이터 보유자에게 집중되는 것은 부당하다는 견해가 있다. ⑤ 데이터 이동권의 도입으로 정보 주체의 데이터 통제 범위가 본인의 행동 양상과 관련된 부분으로 확대되었다. 것은? 5. [A], [B]의 입장에서 ㉮～㉱에 대해 이해한 내용으로 적절하지 않은 ①[A]의 입장에서, ㉮는 데이터 이동권 도입을 통해 ㉯의 데이터를 재사용할 수 있게 되었으므로 데이터 생성 비용을 줄일 수 있다고 보겠군. ②[A]의 입장에서, 정보 주체가 데이터 이동을 요청하여 데이터를 전송받는 제3자가 ㉰라면, ㉰는 분쟁 없이 정보 주체의 데이터를 받게 되어 거래 비용을 줄일 수 있다고 보겠군. ③[B]의 입장에서, ㉰가 ㉱와의 거래에 실패해 데이터를 수집하지 못하여 ㉰에 데이터 생성 비용이 발생하면, 데이터 관련 산업의 시장에 진입하기 어려워질 수 있다고 보겠군. ④[A]와 달리 [B]의 입장에서, 정보 주체의 데이터가 ㉯에서 ㉱로 이동하여 집적․처리될수록 기업 간 공유나 유통이 위축될 수 있다고 보겠군. ⑤[B]와 달리 [A]의 입장에서, ㉯는 ㉮로 데이터를 이동하여 경제적 이득을 취할 수 있으므로 데이터의 공유나 유통의 활성화에 기여할 수 있다고 보겠군. 2 20 3 6. 윗글을 바탕으로 <보기>를 이해한 내용으로 적절하지 않은 것은? [3점] <보 기> A은행은 고객들의 데이터를 수집하고 이를 분석․가공 하여 자산 관리 데이터 서비스인 연령별․직업군별 등 고객 맞춤형 금융 상품 추천 서비스를 제공했다. 갑은 본인의 데이터 제공에 동의하여 A은행으로부터 소정의 포인트를 받았다. 데이터 이동권이 법제화된 이후 갑은 B은행 체크 카드를 발급받은 뒤, A은행에 ‘계좌 자동 이체 항목’, ‘체크 카드 사용내역’, ‘연령별 맞춤형 금융 상품 추천 서비스 내역’을 B은행으로 이동할 것을 요청했다. ① 갑이 본인의 데이터를 이동 요청하면 A은행은 갑의 ‘체크 카드 사용 내역’을 B은행으로 전송해야 한다. ②A은행에 대한 갑의 데이터 이동 요청은 정보 주체의 자율적 관리이므로 강화된 개인 정보 자기 결정권의 행사이다. ③ 데이터의 소유권 주체가 정보 주체라고 본다면, 갑이 A은행으로 부터 받은 포인트는 본인의 데이터 제공에 대한 대가이다. ④ 갑이 본인의 데이터를 보유한 A은행을 상대로 요청한 ‘연령별 맞춤형 금융 상품 추천 서비스 내역’은 데이터 이동권 행사의 대상이다. ⑤ 데이터 이동권의 법제화 이전에도 갑이 A은행에서 B은행으로 이동을 요청한 정보 중에서 ‘계좌 자동 이체 항목’은 이동이 가능했다. 7. 문맥상 ⓐ, ⓑ와 바꾸어 쓰기에 가장 적절한 것은? ⓐ ① ② ③ ④ ⑤ 용이(容易)해져 유력(有力)해져 용이(容易)해져 원활(圓滑)해져 유력(有力)해져 ⓑ 근거(根據)하여 근거(根據)하여 의탁(依託)하여 의탁(依託)하여 기초(基礎)하여",사회,82
"저울은 흔히 지렛대의 원리를 이용하거나 전기 저항 변화를 측정하여 질량을 잰다. 그렇다면 초정밀 저울은 기체 분자나 DNA와 같은 미세 물질의 질량을 어떻게 잴까? 이에 답하기 위해서는 압전 효과에 대한 이해가 필요하다. 압전 효과에는 재료에 기계적 변형이 생기면 재료에 전압이 발생하는 1차 압전 효과와, 재료에 전압을 걸면 재료에 기계적 변형이 생기는 2차 압전 효과가 있다. 두 압전 효과가 모두 생기는 재료를 압전체라 하며, 수정이 주로 쓰인다. 압전체로 사용하는 수정은 특정 방향으로 절단 및 가공하여 납작한 원판 모양으로 만든다. 이후 원판의 양면에 전극을 만든 후 (＋)와 (－)극이 교대로 바뀌는 전압을 가하면 수정이 진동 한다. 이때 전압의 주파수*를 수정의 고유 주파수와 일치시켜 수정이 큰 폭으로 진동하도록 하여 진동을 측정하기 쉽게 만든 것이 ㉠수정 진동자 이다. 고유 주파수란 어떤 물체가 갖는 고유한 진동 주파수인데, 같은 재료의 압전체라도 압전체의 모양과 크기에 따라 달라진다. 수정 진동자에 어떤 물질이 달라붙어 질량이 증가하면 고유 주파수에서 진동하던 수정 진동자의 주파수가 감소한다. 수정 진동자의 주파수는 매우 작은 질량 변화에 민감 하게 변하므로 기체 분자나 DNA와 같은 미세한 물질의 질량을 측정할 수 있다. 진동자에서 질량 민감도는 주파수의 변화 정도를 측정된 질량으로 나눈 값인데, 수정 진동자의 질량 민감도는 매우 크다. 수정 진동자로 질량을 측정하는 원리를 응용하면 특정 기체의 농도를 감지할 수 있다. 수정 진동자를 특정 기체가 붙도록 처리 하면, 여기에 특정 기체가 달라붙으며 질량 변화가 생겨 수정 진동자의 주파수는 감소한다. 일정 시점이 되면 수정 진동자의 주파수가 더 감소하지 않고 일정한 값을 유지한다. 이렇게 일정한 값을 유지하는 이유는 특정 기체가 일정량 이상 달라붙지 않기 때문이다. 혼합 기체에서 특정 기체의 농도가 클수록 더 작은 주파수에서 주파수가 일정하게 유지된다. 특정 기체가 얼마나 빨리 수정 진동자에 붙어서 주파수가 일정한 값이 되는가의 척도를 반응 시간이라 하는데, 반응 시간이 짧을수록 특정 기체의 농도를 더 빨리 잴 수 있다. 그런데 측정 대상이 아닌 기체가 함께 붙으면 측정하려는 대상 기체의 정확한 농도 측정이 어렵다. 또한 대상 기체만 붙더라도 그 기체의 농도를 알 수는 없다. 이 때문에 대상 기체의 농도에 따라 수정 진동자의 주파수 변화를 미리 측정해 놓아야 한다. 그 후 대상 기체의 농도를 모르는 혼합 기체에서 주파수 변화를 측정하면 대상 기체의 농도를 알 수 있다. 수정 진동자의 주파수 변화 정도를 농도로 나누면 농도에 대한 민감도를 구할 수 있다. *주파수: 진동이 1초 동안 반복하는 횟수 또는 전압의 (＋)와 (－)극이 1초 동안, 서로 바뀌고 다시 원래대로 되는 횟수.","8. 윗글에 대한 설명으로 가장 적절한 것은? ① 압전체의 제작 방법을 소개하고 제작 시 유의점을 나열하고 있다. ② 압전 효과의 개념을 정의하고 압전체의 장단점을 분석하고 있다. ③ 압전 효과의 종류를 분류하고 그 분류에 따른 압전체의 구조를 비교하고 있다. ④ 압전체의 유형을 구분하는 기준을 제시하고 초정밀 저울의 작동 과정을 단계별로 설명하고 있다. ⑤ 압전 효과에 기반한 초정밀 저울의 작동 원리를 설명하고 이 원리가 적용된 기체 농도 측정 방법을 소개하고 있다. 3 20 로그인/회원가입 필요없는 무료 입시 자료 사이트 레전드스터디 닷컴! www.LegendStudy.com 4 9. 윗글을 통해 알 수 있는 내용으로 적절하지 않은것은? ① 수정 이외에도 압전 효과를 보이는 재료가 존재한다. ② 수정을 절단하고 가공하여 미세 질량 측정에 사용한다. ③ 전기 저항 변화를 이용하여 물체의 질량을 측정하는 경우가 있다. ④ 같은 방향으로 절단한 수정은 크기가 달라도 고유 주파수가 서로 같다. ⑤ 진동자의 주파수 변화 정도를 측정된 질량으로 나누면 질량에 대한 민감도를 구할 수 있다. 10. ㉠에 대한 이해로 적절하지 않은것은? ① ㉠에는 1차 압전 효과를 보일 수 있는 재료가 있다. ② ㉠에서는 전압에 의해 압전체의 기계적 변형이 일어난다. ③ ㉠에는 전극이 양면에 있는 원판 모양의 수정이 사용된다. ④ ㉠에서는전극에 가하는 전압의 주파수를 수정의 고유 주파수에 맞춘다. ⑤ ㉠의 전극에 가해지는 특정 주파수의 전압은 압전체의 고유 주파수 값을 더 크게 만든다. 11. 윗글을 바탕으로 <보기>를 탐구한 내용으로 가장 적절한 것은? [3점] <보 기> 알코올 감지기 A와 B를 이용하여 어떤 밀폐된 공간에 있는 혼합 기체의 알코올 농도를 측정하였다. 이때 A와 B는 모두 진동자에 알코올이 달라붙을 수 있도록 처리되어 있다. A와 B 모두, 시간이 흐름에 따라 주파수가 감소하다가 더 이상 감소하지 않고 일정하게 유지되었다. (단, 측정하는 동안 밀폐된 공간의 상황은 변동 없음.) ①A의 진동자에 있는 압전체의 고유 주파수를 알코올만 있는 기체에서 미리 측정해 놓으면, 혼합 기체에서의 알코올의 농도를 알 수 있겠군. ②B에 달라붙은 알코올의 양은 변하지 않고 다른 기체가 함께 달라붙은 후 진동자의 주파수가 일정하게 유지된다면, 이때 주파수의 값은 알코올만 붙었을 때보다 더 작겠군. ③A와 B에서 알코올이 달라붙도록 진동자를 처리한 것은 알코올이 달라붙음에 따라 진동자가 최대한 큰 폭으로 진동할 수 있게 하려는 것이겠군. ④A가 B에 비해 동일한 양의 알코올이 달라붙은 후에 생기는 주파수 변화 정도가 크다면, A가 B보다 알코올 농도에 대한 민감도가 더 작다고 할 수 있겠군. ⑤B가 A보다 알코올이 일정량까지 달라붙는 시간이 더 짧더라도 알코올이 달라붙은 양이 서로 같다면, A와 B의 반응 시간은 서로 같겠군.",과학·기술,62
