T,Q,C,A
"(가) 손 흔들고 떠나갈 미련은 없다 며칠째 청산에 와 발을 푸니 ㉠ 흐리던 산길이 잘 보인다. 상수리 열매를 주우며 인가를 내려다보고 쓰다 둔 편지 구절과 버린 칫솔을 생각한다. 남방으로 가다 길을 놓치고 두어 번 허우적거리는 여울물 산 아래는 때까치들이 몰려와 모든 야성을 버리고 들 가운데 순결해진다. 길을 가다가 자주 뒤를 돌아보게 하는 서른 번 다져 두고 서른 번 포기했던 ⓐ 관습들 서쪽 마을을 바라보면 나무들의 잔숨결처럼 ㉡ 가늘게 흩어지는 저녁 연기가 한 가정의 고민의 양식으로 피어오르고 생목 울타리엔 들거미줄 맨살 ㉢ 비비는 돌들과 함께 누워 실로 이 세상을 앓아 보지 않은 것들과 함께 잠들고 싶다. - 이기철, 청산행 - (나) 나는 차를 앞에 놓고 고즈넉한 저녁에 호을로 마신다. 내가 좋아하는 차를 마신다. 그러나 이것은 다만 사실일 뿐, 차의 짙은 향기와는 관계 없이 이것은 물과 같이 담담한 사실일 뿐이다. 누구의 시킴을 받아 참새 한 마리가 땅에 떨어지는 것도 아니고 누구의 손으로 들국화를 어여삐 가꾼 것도 아니다. 차를 마시는 것은 이와 같이 ㉣ 스스로 달갑고 가장 즐거울 뿐, 이것은 다만 사실이며 또 ⓑ 관습이다. 나의 고즈넉한 관습이다. 물에게 물은 물일 뿐 소금물일 뿐, 앞으로 남은 십년을 더 살든지 죽든지 나에게도 나는 나일 뿐, ㉤ 이제는 차를 마시는 나일 뿐, 이 짙은 향기와는 관계도 없이 차를 마시는 사실과 관습은 내가 아는 내게 대한 모든 것이다. 그리고 모든 것에 대한 모든 것도 된다. - 김현승, 사실과 관습 : 고독 이후 -","31. (가), (나)에 대한 설명으로 적절하지 않은것은? ①(가)는 인격화한 대상을 통해 화자의 심리를 내포하고 있다. ②(나)는 대상을 한정하는 어휘들을 사용하여 주제 의식을 강조하고 있다. ③(가)는 (나)와 달리, 공간의 이동에 따라 포착된 사물을 통해 화자의 태도를 드러내고 있다. ④(나)는 (가)와 달리, 화자를 거듭 명시하면서 시상을 전개하고 있다. ⑤(가)와 (나)는 모두, 자연물에 화자의 정서를 투영함으로써 대상에 대한 친밀감을 드러내고 있다. 32. ⓐ, ⓑ에 대한 이해로 가장 적절한 것은? ① ⓐ는 ‘길을 가다가 자주 뒤를 돌아보게’ 하는 것이라는 점에서 다시 돌아갈 수 없는 그리움의 대상이다. ② ⓑ는 ‘호을로’ 하는 행위라는 점에서 행위 주체의 사회적 고립을 드러내고 있다. ③ ⓐ는 바라봄의 대상인 ‘서쪽 마을’과 관련되어 있다는 점에서 피안에 대한 지향을, ⓑ는 일과를 마친 ‘저녁’과 관련되어 있다는 점에서 안식에 대한 지향을 드러내고 있다. ④ ⓐ는 ‘서른 번 다져 두고 서른 번 포기’한 것이라는 점에서 내면의 갈등을, ⓑ는 ‘고즈넉한’ 상황에서 이루어지는 ‘담담한 사실’이라는 점에서 내면의 평정함을 내포한다. ⑤ ⓐ는 사물들을 ‘내려다보’아 촉발된 것이라는 점에서 자기 연민의 성격을, ⓑ는 ‘달갑고’, ‘좋아하는’ 것이라는 점에서 자기 위안적 성격을 띠고 있다. 33. ㉠～㉤에 대한 이해로 적절하지 않은것은? ① ㉠은 대상이 이전에는 제대로 파악되지 않았음을 드러내는 표현이다. ② ㉡은 ‘저녁 연기’의 형상으로 ‘한 가정’의 상황과 처지를 시각화한 표현이다. ③ ㉢은 ‘맨살’을 드러낸 ‘돌들’이 부대끼는 형상으로 세파에 시달리는 모습을 나타내는 표현이다. ④ ㉣은 ‘차를 마시는 것’이 화자의 선호에 따른 주체적 행위임을 드러내는 표현이다. ⑤ ㉤은 ‘나’에 대한 현재의 인식이 이전과는 달라졌음을 드러내는 표현이다. 34. <보기>를 참고하여 (가), (나)를 감상한 내용으로 적절하지 않은 것은? [3점] <보 기> 자연과 절대자는 각각 인간에게 안식을 주거나 인간과 세계를 규정하는 중요한 준거로 인식되어 왔다. (가)는 세속의 일상을 떠나 자연에 들어온 화자가 점차 자연에 동화되어 가는 과정과 심리 상태를 그리고 있다. (나)는 자신과 세계 인식의 준거였던 절대자와의 관계를 회의하고 자신이 경험한 사실에 기초하여 존재를 인식하겠다는 태도를 표명하고 있다. ①(가)의 ‘쓰다 둔 편지 구절과 버린 칫솔을 생각한다’는 것은 자연에 온전히 동화되지 못하는 화자의 심리를 보여 주는 것이겠군. ②(나)의 ‘차를 마시는’ 행위가 ‘내가 아는 내게 대한 모든 것’, ‘모든 것에 대한 모든 것’으로 확장되는 것은 경험적 사실을 ‘나’와 모든 존재들에 대한 인식의 유일한 근거로 삼겠다는 의식이 반영된 것이겠군. ③(가)의 ‘발을 푸니’ ‘잘 보인다’는 것은 화자가 자연에 친숙해지는 심리 상태를, (나)의 ‘앞으로 남은 십년을 더 살든지 죽든지’는 절대자에 대해 회의하고 현실에 얽매이지 않겠다는 태도를 드러내고 있겠군. ④(가)의 ‘여울물’과 ‘때까치들’에는 자연에 들어와서 느끼는 화자의 심리가 투사되어 있음을, (나)의 ‘참새’의 떨어짐이 ‘누구’에 의한 것이 ‘아니’라는 데에서 절대자와의 관계에 대한 회의가 드러나 있음을 알 수 있겠군. ⑤(가)의 ‘이 세상을 앓아 보지 않은 것들과 함께’는 자연에 동화되려는 태도를, (나)의 ‘물은 물일 뿐’은 경험적 사실로만 대상을 인식하겠다는 태도를 드러내는 것이겠군.",현대시,61.2
"안녕하세요. ○○○입니다. 여러분, 어제 급식에 나온 김자반 맛있게 드셨나요? 예, 많은 분들이 고개를 끄덕이시네요. 그럼 여기 사진 하나 보실까요? (화면 제시) 이 사진은 김을 사기 위해 길게 줄을 서 있는 외국인들의 모습입니다. 외국인에게도
우리 김의 인기가 대단하지요? 그런데 K-푸드 선두 주자이자 세계인의 입맛을 사로잡은 우리 김을 어떻게 양식하는지 아시는 분은 많지 않을 것 같은데요. (반응을 살피며) 예, 그래서 오늘 제가 김 양식 방법에 대해 소개하려고 합니다. 우리나라의 대표적인 김 양식 방법에는 두 가지가 있습니다. (㉠화면 제시) 지금 보시는 화면은 지주식 양식 방법의 모습입니다. 수심이 낮은 가까운 바다에 김발을 매단 버팀목을 세워 김을 양식하는 것이지요. 밀물과 썰물에 따라 김발이 햇빛과 공기에 노출되기 때문에 맛과 품질이 좋은 김을 생산할 수 있습니다. 그런데 김이 햇빛과 공기에 노출되면 왜 맛과 품질이 좋아질까요? (오른손을 내밀며) 그것은 바로, 광합성이 활발해지고 살균 작용이 일어나기 때문입니다. 다만, 김은 바다의 양분을 먹고 자라야 하기 때문에 지주식 양식 방법은 김의 생장 속도가 더디다는 단점이 있습니다. 지주식 양식보다 좀 더 먼 바다에서 김을 양식하는 방법도 있습니다. (㉡화면 제시) 화면에 보이는 부류식 양식 방법입니다. 이 방법은 뜸에 김발을 매달아 수면 아래 잠기게 하여 김을 키우는 것이지요. 뜸은 김발을 지탱하게 하는 물건입니다. 김이 바닷물에 잠겨 있어 생장이 빨라 지주식 양식 방법에 비해 대량 생산이 가능합니다. 그런데 이 양식 방법은 김이 햇빛과 공기에 직접 노출되지 않아 갯병에 취약한 면이 있습니다. 갯병을 막기 위해 일정 시간 동안 김을 햇빛과 공기 중에 노출하는 김발 뒤집기 작업을 하는데, 이를 노출 부류식 양식 방법으로 구분하기도 합니다. 이렇게 생산된 김은 김부각, 조미김 등 다양한 상품으로 세계 곳곳에 수출되고 있습니다. 검은 반도체라 불리며 수산 식품 수출 1위, 연간 수출액 1조 원을 달성한 우리 김! 우리 김의 미래를 함께 응원해 주세요. 발표 마치겠습니다. ","35. 위 발표자의 말하기 방식으로 가장 적절한 것은? ① 청중의 실천을 강조하기 위해 전문가의 의견을 인용하고 있다. ② 청중의 요구를 충족하기 위해 발표 중간에 내용을 요약하고 있다. ③ 청중의 관심을 끌기 위해 화제와 관련한 청중의 경험을 환기 하고 있다. ④ 청중의 이해를 돕기 위해 비언어적 표현을 활용하여 발표 순서를 안내하고 있다. ⑤ 청중의 궁금증을 해소하기 위해 스스로 묻고 답하는 방식으로 용어의 개념을 설명하고 있다. 36. 다음은 발표자가 보여 준 자료이다. 발표자의 시각 자료 활용에 대한 설명으로 가장 적절한 것은? [자료1] [자료2] ① 김발 뒤집기로 바다의 양분을 김에 공급할 수 있다는 것을 설명하기 위해 ㉠에 [자료1]을 활용하였다. ② 햇빛과 공기에 김이 노출되지 않아 갯병에 걸릴 수 있음을 설명하기 위해 ㉡에 [자료1]을 활용하였다. ③ 밀물과 썰물의 반복으로 살균 작용이 활발해짐을 설명하기 위해 ㉠에 [자료2]를 활용하였다. ④ 김의 생장 속도가 빨라 대량 생산에 유리하다는 점을 설명하기 위해 ㉡에 [자료2]를 활용하였다. ⑤ 두 양식 방법을 구별하는 요소가 김발의 유무라는 점을 설명하기 위해 ㉠에 [자료1]을, ㉡에 [자료2]를 활용하였다. 37. 발표 내용을 바탕으로 할 때, <보기>에 나타난 학생의 반응에 대한 이해로 적절하지 않은것은? <보 기> 학생1: 김이 광합성을 하지 않는다고 생각했는데, 김도 광합성을 하는구나. 그런데 김이 광합성을 하면 왜 맛과 품질이 좋아지는지 궁금한걸. 그 내용이 발표에 포함되어 있었으면 좋았을 텐데. 학생2: 외국인들이 김을 사려고 줄을 서 있는 사진 덕분에 김의 인기를 실감할 수 있었어. 그런데 수산 식품 수출 1위, 연간 수출액 1조 원이라는 내용이 정확할까? 학생3: 해조류인 김도 양식한다는 걸 알게 됐어. 광어, 우럭 같은 어류만 양식하는 줄 알았는데 그게 아니었군. 다른 해조류도 양식한다면 김 양식과 어떻게 다른지 정보를 찾아봐야겠어. ①‘학생1’은 알고 싶은 정보가 발표에서 다루어지지 않았음을 아쉬워하고 있다. ②‘학생2’는 발표에 포함된 정보가 믿을 만한지 의문을 드러내고 있다. ③‘학생3’은 발표의 내용과 관련하여 추가적인 정보를 탐색하려 하고 있다. ④‘학생1’과 ‘학생3’은 모두, 발표에서 언급된 정보를 통해 자신이 평소 알고 있던 바를 수정하고 있다. ⑤‘학생2’와 ‘학생3’은 모두, 발표 내용을 바탕으로 발표에서 제공하지 않은 정보를 추론하고 있다",화법,87
"(가) 부원 1 : 도서관에 전파 식별 시스템을 설치하고 새로 단장한 지 일주일이 지났네! 학생들 반응이 좋은 것 같아. 그렇지 않니? 부원 2 : 맞아. 반 친구들이 도서관 이용이 편리해졌다는 말을 많이 하더라. 그런 말을 들으니, 전파 식별 시스템을 도입하자고 건의 하길 잘했다는 생각이 들었어. 부원 3 : 전에는 대출이나 반납을 하려면 줄을 길게 서야 했는데, 이젠 안 그래도 돼서 좋다고 하더라. 부원 1 : 바코드를 한 권씩 일일이 찍느라 학생들이 몰릴 땐 시간이 많이 걸렸지. 지금은 그렇지 않으니까. 부원 3 : ㉠ 전파 식별 시스템으로 바뀌니까 여러 권을 동시에 대출하고 반납할 수 있어서 그런가 보다. 부원 2 : 자가 대출 반납기를 사용하게 돼서 점심시간 말고도 도서관을 개방할 수 있게 된 덕분이기도 하고. 부원 1 : 우리 도서부 입장에서도 새 시스템을 활용하니까 장서 관리도 효율적이지 않니? 전보다 훨씬 빨리 끝낸 것 같아. 부원 3 : 그래. ㉡ 장서 점검기로 한 번에 많은 책을 확인할 수 있어서 제자리에 있지 않은 책을 빠르게 정리할 수 있었잖아. 그래서 학생들이 책을 찾기 쉬워졌어. 부원 1 : 그 덕분에 교과와 관련성이 높거나 학생들의 선호도가 높은 책을 눈에 잘 띄는 서가에 배치할 수 있었어. 그래도 시스템이 자리 잡을 때까지는 우리가 계속해서 신경 써야 할 것 같아. 책 읽기 좋은 환경을 조성하는 일이라든지? 부원 3 : 근데, 아직 달라진 도서관에 대해 잘 모르는 학생들이 있더라. 이 문제부터 해결하는 게 어때? 부원 2 : 그럼 우리가 달라진 도서관에 대해 소개하는 안내문을 써서 학급 게시판에 붙여 두자. 부원 1 : 그러니까 안내문으로 학생들의 도서관 이용을 돕자는 말이지? 학교에서 도서관을 새로 단장했다고 학교 누리집에 안내를 해 주긴 했는데, 무엇이 달라졌는지 자세한 내용은 없더라. 부원 3 : 그래. 전파 식별 시스템 도입 전과 비교해서 불편한 점이 어떻게 개선되었는지를 안내하면 좋을 것 같아. 구체적으로 어떤 내용을 넣으면 될까? 부원 2 : ㉢ 자가 대출 반납기가 있어서 직접 대출과 반납을 할 수 있다고 알려 주면 친구들이 관심을 가질 것 같아. 부원 1 : 좋은 생각이야. 학생증이 없더라도 아이디와 비밀번호를 입력하면 대출과 반납을 할 수 있다는 것도 알려 주자. 부원 2 : ㉣ 대출하지 않은 책을 도서관 밖으로 들고 나가면 경보음이 울린다는 설명도 꼭 넣었으면 해. 부원 3 : ㉤ 도서관을 새롭게 단장한 만큼 우리가 진행하는 도서관 행사를 소개하면 더 많은 학생이 도서관에 방문할 거야. 부원 1 : 그럼 내가 내용을 정리해서 초고를 써 볼게. 부원 2, 3 : 좋아! (나) 우리 학교 도서관이 새 단장을 마쳤습니다. 전파 식별 시스템 도입으로 달라진 우리 학교 도서관을 여러분에게 소개합니다. 길게 줄 서는 일 없이 대출?반납이 가능합니다. 전파 식별
시스템 덕분에 바코드를 일일이 찍지 않고, 한 번에 여러 권을
동시에 처리할 수 있기 때문입니다.
대출 가능 시간이 확대되었습니다. 과거에는 도서부원이 있는
점심시간에만 대출이 가능했습니다. 하지만 이제는 도서부원이
없어도, 점심시간이 아닌 때에도 직접 도서 대출이 가능합니다.
도서부원은 앞으로 책 읽기 좋은 환경을 조성하는 일에 힘쓰겠습니다.
자가 대출 반납기 이용 방법을 안내합니다. 먼저, 자가 대출
반납기에 책들을 올리고 학생증을 인식시킵니다. 학생증이 없을
때는 아이디와 비밀번호를 입력합니다. 화면에 표시된 도서
목록을 확인한 후 대출 또는 반납 버튼을 누르고, 완료된 후
확인증을 받으면 됩니다.
도서관 이용 편의성을 고려하여 도서를 배치했습니다. 이전에는
제자리에 없던 도서가 많았지만, 지금은 정리되어 원하는 도서를
바로 찾을 수 있습니다. 특히, 교과 연계 도서, 선호도가 높은
도서를 눈에 잘 띄는 서가에 배치해 두었습니다.
도서관 출입구에 도서 분실 방지 장치가 작동 중입니다. 대출
절차 없이 도서관 밖으로 책을 들고 나가면 경보음이 울립니다.
도서관의 새 단장을 기념하기 위해 다양한 행사를 준비하였
습니다. 추천 도서 소개, 도서 속 보물찾기 등이 있습니다.
더욱 편리해진 도서관, 앞으로도 많은 이용 바랍니다.
○○고등학교 도서관","38. 다음은 (가)의 건의를 앞두고 도서부원들이 나눈 대화의 일부이다. (가)를 참고할 때 ⓐ에 해당하는 내용으로 가장 적절한 것은? 부원2: 교장 선생님과의 대화 시간에 전파 식별 시스템을 도입하자고 건의하면 어떨까? 부원1: 그래. 만족도 조사 결과를 근거로 현재 도서관에서 학생들이 느끼는 불편한 점을 정리해서 말씀드리자. 부원3: 전파 식별 시스템이 도입되었을 때 ⓐ기대할 수 있는 효과에 대해서도 말씀드리면 설득력이 있을 거야. ① 원활한 장서 관리로 학습과 관련된 도서를 쉽게 찾을 수 있어 과제 수행에 도움을 받을 수 있음. ② 학생증 없이 도서를 대출할 때 아이디와 비밀번호를 입력해야 하는 번거로움을 해결할 수 있음. ③ 점심시간에도 도서관을 개방할 수 있어 오래 기다리지 않고 책을 빌릴 수 있음. ④ 동선을 고려한 서가와 책상의 배치로 도서를 편안하게 열람할 수 있음. ⑤ 도서관 소식을 전하는 학교 누리집 게시판이 활성화될 수 있음. 14 20 이 문제지에 관한 저작권은 한국교육과정평가원에 있습니다. (화법과 작문) 3 39. [A], [B]의 발화에 대한 설명으로 적절하지 않은것은? ①[A]에서 ‘부원1’은 질문의 형식을 통해 부원들의 생각이 자신과 같은지 확인하고 있다. ②[A]에서 ‘부원2’는 직전 발화를 긍정하며 그 이유를 언급하고 있다. ③[B]에서 ‘부원3’은 자신이 인식한 문제 상황을 해결하자고 제안하고 있다. ④[B]에서 ‘부원2’는 구체적인 방법을 제시하며 부원들에게 함께할 것을 요청하고 있다. ⑤[B]에서 ‘부원1’은 직전 발화를 재진술하며 새로운 절충안을 제시하고 있다. 40. 다음은 (가)의 ㉠～㉤을 바탕으로 ‘부원1’이 작성한 메모의 일부이다. 메모의 내용이 (나)에 반영된 양상으로 적절하지 않은 것은? [3점] ① ㉠을 바탕으로 작성된 메모의 ‘여러 권 동시 처리 가능’은, 대출에 소요되는 시간이 줄었다는 내용으로 (나)에 반영되었다. ② ㉡을 바탕으로 작성된 메모의 ‘장서 점검기 활용의 이점’은, 이용 편의를 고려해서 도서를 정리했다는 내용으로 (나)에 반영 되었다. ③ ㉢을 바탕으로 작성된 메모의 ‘도서부원 없이도 대출 가능’ 이라는 내용은, 과거에는 도서부원이 있을 때에만 도서 대출이 가능했다는 내용과 함께 (나)에 반영되었다. ④ ㉣을 바탕으로 작성된 메모의 ‘도서 분실 방지 장치 작동 중’ 이라는 내용은, 경보음이 울렸을 때의 대처 방안과 함께 (나)에 반영되었다. ⑤ ㉤을 바탕으로 작성된 메모의 ‘도서관 행사’는, 행사의 종류를 소개하는 내용으로 (나)에 반영되었다. 41. (나)를 작성할 때 활용한 내용 조직 방법에 대한 설명으로 가장 적절한 것은? ①‘수월해진 대출․반납’은 시간의 흐름에 따른 순서를 중심으로 내용을 조직하였다. ②‘이용 편의성을 높인 도서 배치’는 과거와 현재 사이의 공통점을 중심으로 내용을 조직하였다. ③‘수월해진 대출․반납’과 ‘대출 가능 시간 확대’는 모두, 문제점을 밝히고그 해결 방안을 제시하는 방식으로 내용을 조직하였다. ④‘도서 분실 방지 장치 작동’과 ‘새 단장 기념 행사’는 모두, 현상의 원인을 먼저 분석하고그에 따른 결과를 제시하는 방식으로 내용을 조직하였다. ⑤‘자가 대출 반납기 이용 방법’은 ‘이용 편의성을 높인 도서 배치’와 달리, 일련의 절차를 차례로 제시하는 방식으로 내용을 조직하였다. 42. 다음은 (나)를 고쳐 쓰기 위해 활용한 점검 항목이다. ㉮～㉲를 기준으로 (나)를 점검한 내용으로 적절하지 않은것은? 점검 항목 안내문의 형식을 갖추고 있는가? ····································· ㉮ 글의 목적이 드러나는가?················································· ㉯ 필요한 정보를 분명하게 전달하는가? ····························· ㉰ 소제목과 문단의 내용이 부합하는가? ····························· ㉱ 독자가 이해하기 쉽게 전달하는가? ································· ㉲ ① ㉮: 안내문의 제목이 없어 독자의 주목을 끌기 어려우니, 전체적인 내용을 고려해 제목을 만들면 어떨까? ② ㉯: 안내문을 쓴 목적이 제시되어 있지 않으니, 글의 처음 부분에 목적을 기술하는 것이 어떨까? ③ ㉰: 대출 가능 시간을 확실하게 알기 어려우니, 시간을 명시적 으로 밝히면 어떨까? ④ ㉱: 소제목으로 포괄할 수 없는 문장이 있으니, 그 문장을 삭제하면 어떨까? ⑤ ㉲: 글보다 그림을 더 쉽게 이해하는 독자도 있으니, 자가 대출 반납기 이용 방법을 그림으로 표현하여 추가하면 어떨까?",화법과 작문,72.8
