T,Q,C,A
"(가) 전통적인 윤리학의 주요 주제는 ‘선’, ‘올바름’과 같은 도덕 용어에 대한 해명을 바탕으로 무엇이 옳고 그른지를 판정하는 객관적 근거를 ⓐ 찾는 것이다. 그러나 윤리학은 오랫동안 그에 대한 만족스러운 답을 ⓑ 내놓지 못했다. 이러한 상황에서 에이어 는 도덕적으로 옳고 그름에 관한 문장인 도덕 문장이 진리 적합성, 즉 참 또는 거짓일 수 있다는 성질을 갖지 않는다는 주장을 ⓒ 펼쳤다. 에이어는 진리 적합성을 갖는 모든 문장은 그 문장에 사용된 단어의 정의를 통해 검증되는 분석적 문장이거나 경험적 관찰에 의해 검증되는 종합적 문장이라는 원리를 바탕으로 도덕 문장은
진리 적합성이 없다고 주장했다. 우선 그는 도덕 문장은 분석적이지 않다는 기존의 논의를 수용했다. ‘선은 A이다.’라는 도덕 문장이 분석적이려면, 술어인 ‘A’가 주어인 ‘선’이라는 개념 속에 내포되어 있어야 한다. 하지만 ‘선’은 속성이나 내용을 더 이상 분석할 수 없는 단순 개념이므로 해당 문장은 분석적이지 않다. 그렇다고 해서 ‘선은 A이다.’라는 도덕 문장이 경험적 관찰로 검증될 수 있는 것도 아니다. ‘선’ 그 자체는 우리의 감각으로 검증할 수 없기 때문이다. 도덕 문장은 다양한 감정이나 태도를 표현하고 타인의 감정을 ⓓ 불러일으키는 정서적 의미를 갖는다고 에이어는 주장했다. 그는 많은 사람들이 도덕 문장이 진리 적합성을 갖는다고 오해하는 것은 도덕 용어의 두 가지 용법을 구분하지 못해서라고 주장한다. 그에 따르면 도덕 용어는 감정을 표현하는 표현적 용법으로도, 세계에 관한 어떤 사실을 기술하는 기술적 용법으로도 사용될 수 있다. 만약 ‘도둑질은 나쁘다.’가 도둑질이 사회적으로 배척된다는 사실을 기술하는 문장이라면, 이 문장은 도덕적으로 옳고 그름에 관한 것이 아니다. 따라서 이 문장은 도덕 문장이 아니고, 경험적으로 검증이 가능하다. 반대로 그 문장이 도둑질에 대한 화자의 감정을 표현한 문장이라면 이는 도덕 문장이며 어떤 사실을 기술한 것이 아니다. 에이어에게는 ‘도둑질은 나쁘다.’와 같은 도덕 문장을 진술하는 것은 감정을 담은 어조로 ‘네가 도둑질을 하다니!’라고 말하는 것과 다름없기 때문이다. 그의 주장대로라면 도덕 문장은 감정을 표현하는 도덕 주체로부터 독립적으로 존재하는 무언가를 기술할 수 없다. 이는 전통적인 윤리학자들의 기본 가정을 부정하는 급진적 주장이지만 윤리학에 새로운 사고를 ⓔ 열어 준 선구적인 면도 있다. (나) 논리학에서 제기된 의문이 윤리학의 특정 견해에 대한 비판이 되기도 한다. 다음 논의는 이를 보여 준다. ‘P이면 Q이다. P이다. 따라서 Q이다.’인 논증을 전건 긍정식이라 한다. 전건 긍정식은 ‘P이면 Q이다.’와 ‘P이다.’라는 두 전제가 참이면 결론 ‘Q이다.’는 반드시 참이라는 뜻에서 타당하다. 그런데 어떤 문장이 단독으로 진술되는 경우에는 감정이나 태도를 표현할 수 있지만 그 문장이 조건문인 ‘P이면 Q이다.’의 부분으로 포함되는 경우에는 그렇지 않다. ‘귤은 맛있다.’는 화자의 선호라는 감정을 표현한다. 하지만 그 문장이 ‘귤은 맛있다면 귤은 비싸다.’처럼 조건문의 일부가 되면 귤에 관한 화자의 선호를 표현하지 않는다. 이에 전건 긍정식의 P가 감정이나 태도를 표현하는 문장일 때 ‘P이면 Q이다.’의 P와 ‘P이다.’의 P 사이에 내용의 차이가 생기므로, 전건 긍정식임에도 두 전제의 참이 결론 ‘Q이다.’의 참을 보장하지 않는다는 것이 ㉠ 몇몇 논리학자들이 제기한 문제였다. 전건 긍정식인 ‘표절은 나쁘다면 표절을 돕는 것은 나쁘다. 표절은 나쁘다. 따라서 표절을 돕는 것은 나쁘다.’라는 논증은 직관적으로 타당해 보인다. 하지만 ‘표절은 나쁘다.’가 감정을 표현했다면, 위 논증은 타당하지 않다고 해야 한다. 그러므로 에이어의 윤리학 견해를 고수하려면, 도덕 문장을 포함하는 전건 긍정식의 타당성을 부정하거나, 전건 긍정식은 도덕 문장을 포함할 수 없다고 해야 한다. 이 쟁점에 대해 행크스는 다음과 같이 논의를 전개하였다. ‘표절은 나쁘다.’라는 문장은 표절이라는 대상에 나쁨이라는 속성을 부여하는 내용을 가진다. 그리고 화자의 문장 진술은 그 내용과 완전히 무관할 수는 없기 때문에 그런 문장은 단독으로 진술되든 그렇지 않든 판단적이다. 문장이 판단적이라는 것은, 대상에 속성을 부여하는 내용을 지니는 것이 그 문장의 본질이라는 것을 뜻한다. 도덕 문장을 비롯한 모든 판단적 문장은 참 또는 거짓일 수 있다. 조건문에 포함된 문장도 판단적이라는 점에서 단독으로 진술될 때와 내용의 차이가 없다. 그러므로 도덕 문장을 포함하는 전건
긍정식은 타당해 보일 뿐 아니라 실제로도 타당하다. 그렇다면 ‘P이면 Q이다.’에 포함된 ‘P이다.’가 단독으로 진술된 경우와 다른 점은 무엇인가? 가령 ‘귤은 맛있다.’는, ‘귤은 맛있다면 귤은 비싸다.’라는 조건문에 포함되는 경우 화자가 대상에 속성을 부여하는 행위를 하는 것은 아니기에 그것의 판단적 본질을 발현하지 못한다. 그러나 이 맥락에서도 조건문에 포함된 ‘귤은 맛있다.’는 판단적 본질을 여전히 잃지 않는다. 다시 말해, 그 문장 자체는 대상에 속성을 부여하는 내용을 지닌다.","12. (가)에 나타난 에이어의 입장으로 적절하지 않은것은? ① 도덕 용어를 기술적 용법으로 사용한 문장은 검증이 가능하다. ② 표현적 용법을 활용한 도덕 문장은 자신의 감정을 표현하는 문장과 동일한 의미를 표현한다. ③ 주어와 술어의 의미 관계를 통해 어떤 문장을 검증할 수 있다면 그 문장은 분석적 문장이다. ④ 도덕 용어의 용법은 도덕 용어가 기술하는 사실의 종류에 따라 기술적 용법과 표현적 용법으로 구분할 수 있다. ⑤ 도덕 문장에 진리 적합성이 있다는 오해는 도덕 문장을 세계에 대한 어떠한 사실을 기술한 것으로 해석한 데에 기인한다. 13. [A]로부터 추론한 내용으로 가장 적절한 것은? ①‘귤은 맛있다면 귤은 비싸다.’에 포함된 ‘귤은 맛있다.’는 판단적 이지 않다. ②‘표절은 나쁘다.’는 단독으로 진술되었을 때에만 참 또는 거짓일 수 있다. ③‘귤은 맛있다.’는 조건문의 일부로 진술될 때는 대상에 속성을 부여하는 내용을 지니지 않는다. ④ 화자는 귤이 맛있음의 속성을 가진다는 내용과 완전히 무관한 채로 ‘귤은 맛있다.’를 진술할 수 있다. ⑤‘표절은 나쁘다.’는 화자가 표절에 나쁨을 부여하지 않는 맥락에서도 그것의 판단적 본질을 유지할 수 있다. 14. 다음은 윗글을 읽고 학생이 작성한 학습 활동지이다. 윗글을 바탕으로 할 때, 적절하지 않은것은? □다음의 진술에 대해 윗글에 제시된 학자들이 보일 수 있는 견해를 작성해 봅시다. [진술1] 객관적으로 존재하는 도덕적 사실이 있다. ∙전통적인 윤리학자: 옳다. 도덕적 판단의 근거는 도덕 주체로 부터독립적으로 존재하기 때문이다. ······························ ① ∙에이어: 옳지 않다. 도덕 문장은 도덕 주체로부터 독립적일 수 없기 때문이다. ···························································· ② [진술2] 도덕 문장은 참 또는 거짓이라는 속성을 갖는다. ∙에이어: 옳지 않다. 도덕 문장은 분석적이지도 종합적이지도 않기 때문이다. ·································································· ③ ∙행크스: 옳다. 도덕 문장은 도덕 용어가 나타내는 속성에 비추어 참 또는 거짓이 정해지기 때문이다. [진술3] 전건 긍정식의 두 전제에 공통으로 포함된 도덕 문장은 내용이 다르다. ∙에이어: 옳다. 도덕 문장은 전건 긍정식의 전제로 사용되면 진리 적합성을 갖기 때문이다. ········································· ④ ∙행크스: 옳지 않다. 단독으로 진술된 문장은 조건문의 일부로 사용된 때와 내용 차이가 없기 때문이다. ······················· ⑤ 15. 윗글을 바탕으로 ㉠을 이해한 내용으로 적절하지 않은것은? ① 에이어의 윤리학 견해가 옳다면 전건 긍정식이 직관적으로 타당해 보이게 된다는 점에서, ㉠은 에이어에 대한 비판이 된다. ② ㉠에 따르면, 도덕 문장을 포함하는 전건 긍정식이 타당하다면 도덕 문장이 감정을 표현한다는 견해는 수용될 수 없다. ③ ㉠은 전건 긍정식이 타당하려면 두 전제 모두에 나타난 문장의 내용이 일치해야 함에 기초한다. ④ ㉠은 도덕 문장뿐 아니라 개인적 선호를 나타내는 문장에 대해서도 제기될 수 있다. ⑤ 도덕 문장을 판단적이라고 보는 이론에 따르면 ㉠은 애당초 발생하지 않는다. 5 20 이 문제지에 관한 저작권은 한국교육과정평가원에 있습니다. 6 16. 윗글과 <보기>를 비교하여 이해한 내용으로 적절하지 않은 것은? [3점] <보 기> ‘자선은 옳다.’는 자선에 대한 찬성, ‘폭력은 나쁘다.’는 폭력에 대한 반대라는 태도를 표현한다. 도덕 문장을 포함하는 ‘자선은 옳다면 봉사는 옳다.’라는 조건문은 ‘태도에 대한 태도’를 표현한다. 위와 같은 주관적 태도들에는 참, 거짓이 없다. ‘자선은 옳다면 봉사는 옳다.’와 ‘자선은 옳다.’가 나타내는 태도를 지니면서, ‘봉사는 옳다.’에 반대하는 것은 비일관적이다. ‘자선은 옳다면 봉사는 옳다. 자선은 옳다. 따라서 봉사는 옳다.’가 타당하다는 것은 이런 뜻이다. ① 도덕 문장이 태도나 감정을 표현한다는 주장은, 도덕 문장을 포함하는 조건문이 ‘태도에 대한 태도’를 표현한다는 <보기>의 주장과 상충하는군. ② 논증의 타당성이 전제와 결론의 참에 의해 규정된다는 주장은, 타당성을 논증에 나타난 태도 사이의 관계에 의해 규정할 수 있다는 <보기>의 주장과 상충하는군. ③ 무엇이 윤리적으로 옳고 그른지에 대한 객관적 기준을 세워야 한다는 주장은, 도덕 문장은 찬성과 반대라는 주관적 태도를 나타낸다는 <보기>의 주장과 상충하는군. ④‘귤은 맛있다.’가 귤에 대한 화자의 선호를 표현한다는 주장은, ‘자선은 옳다.’가 자선에 대한 화자의 찬성을 표현한다는 <보기>의 주장과 상충하지 않는군. ⑤‘도둑질은 나쁘다.’가 화자의 정서를 표출하므로 진리 적합성이 없다는 주장은, 폭력에 대한 화자의 태도를 표현하는 문장이 참, 거짓일 수 없다는 <보기>의 주장과 상충하지 않는군. 17. 문맥상 ⓐ～ⓔ와 바꿔 쓰기에 가장 적절한 것은? ① ⓐ: 수색하는 ② ⓑ: 제시하지 ③ ⓒ: 전파했다 ④ ⓓ: 발산하는 ⑤ ⓔ: 공개하여",인문,45.5
"장 소저 가 남복을 벗고 담장 소복으로 여복을 개착하고 금로에 향을 사르며 시랑의 영위 먼저 차린 후 제문을 읽으니, ⓐ 그 글에 하였으되, ‘유세차 기축 삼월 정묘 삭 십오 일에 기주 장 한림의 딸 애황은 감히 이부 시랑 이 공 영위 앞에 아뢰나이다. 오호 애재라! 소첩의 부친이 대인과 사귐이 깊사옵더니, 그 후에 대인은 귀자를 두시고 부친은 소첩을 얻으시니 피차에 동년 동일생이라. 부친이 신기한 꿈을 꾸고는 대인과 진진지연* 을 깊이 맺었더니, 슬프다, 양가 시운이 불리하여 대인은 간신의 모해를 입어 외딴섬에 유배 가시고, 부친은 대인의 억울함과 소첩의 앞길이 그릇됨을 원통히 여겨 걱정과 분노가 병이 되어 중도에 세상을 버리시니, 모친 또한 부친의 뒤를 따라 별세하시니, 외롭고 연약한 소첩은 의지할 곳이 없더라. 간적 왕희가 첩의 고독함을 업신여겨 혼인을 강제하옵기로 변복 도주하였다가, 남자로 행세하여 용문에 올라 남적을 멸하고 대공을 이룸은, 적자 왕희를 없이하여 원통함을 풀고 대인과 공자를 찾아 혼약을 이루기 위함이었는데, 사신의 말을 들으니 대인 부자가 형적이 없다 하니, 반드시 수중고혼이 되신지라. 어찌 참통치 않으리잇고. 이에 한 잔 술을 바치옵나니 삼가 바라건대 존령은 흠향 하옵소서.’ 하였더라. (중략) 각설. 이 공자 대봉이 부친을 모시고 ㉠ 용궁을 떠나 여러 날만에 ㉡황성에 올라와 머물 곳을 정한 후, 흉노의 머리 벤 것을 봉하여 성상께 올릴새 상소를 지어 전후사연을 주달하였거늘, 이때 성상이 이 시랑 부자의 생사를 알지 못하시고 장 소저의 앞길을 애련히 여기사 마음에 잊지 못하시더니, 또 장 소저의 상표가 이르렀거늘 상이 반기사 급히 열어 보시니 왈, ‘신첩 장애황은 일장 표를 용탑 하에 올리나이다. 신첩이 성상의 큰 은혜를 받자와 바닷가에서 제를 올려 고혼을 위로하오나, 이승과 저승이 판이하게 달라 영혼이 자취가 없사오니, 비록 앞에 와 흠향하온들 어찌 알 리 있사오리잇가. 아득한 경상과 슬픈 마음을 진정치 못하와 제를 지내며 통곡하옵더니, 천우 신조하와 삭발 승려를 만나오니 이 곧 시랑 이익의 처 양씨라. 비록 성혼 행례는 아니 하였사오나 어찌 시어머니와 며느리 사이가 아니리잇가. 일비일희하여 즐겁기 무궁하오니, 이는 다 성상의 넓으신 덕택으로 말미암음이라. 그러나 왕희 부자는
국가를 혼란스럽게 한 간신이옵고 신첩의 원수라. 바라건대 폐하는 왕희 부자를 엄형 국문하사 국법을 밝히시고, 그 부자를 신첩에게 내어 주시면 남선우 베던 칼로 난신을 죽여 이익의 부자에게 제하여 영혼을 위로하리이다.’ 하였더라. 상이 다 보신 후 정히 처결코자 하시더니, 이때 또 하나의 표문이 올라오거늘, 상이 의괴하여 열어 보시니 ⓑ 그 소에 하였으되, ‘죄신 이대봉은 황공함과 두려운 마음으로 머리를 조아려 절을 올리며 한 장 표문을 황상 용탑 하에 바치옵나이다. 신의 부자가 간신 왕희의 모함을 입었사오나, 폐하의 성덕을 입사와 이 한목숨에 너그러움을 베풀어 ㉢ 해도에 내치신 덕택으로 유배지로 가옵더니, 도중을 향하와 배를 타고 대해 중에 행하옵더니, 뜻밖에 뱃사람들이 달려들어 아비를 결박하여 물에 던지거늘, 신의 아비 죽는 양을 보고 또한 뒤를 따라 수중에 빠지오매 거의 죽게 되었삽더니, 마침 서해 용왕의 구함을 입어 살아나 서역 천축국 ㉣ 백운암에 가 팔 년을 의탁하였나이다. 생각하옵건대 신의 부자가 국가의 죄인이라. 타처에 오래 있사옴이 옳지 않아 세상에 나와 수중에 빠진 아비 유골이나마 찾고 고국에 있는 어미를 찾아보고자 하와 중원으로 돌아가옵다가, 농서에서 한나라 장수 이릉의 영혼을 만나 갑옷과 투구를 얻고, 사평에서 오추마를 얻으며, 화용도에서 관 공의 영혼을 만나 칼을 얻어, 황성으로 향코자 하옵다가, 반적 흉노가 천자의 자리를 범하여 황성을 함몰하고 어가가 ㉤금릉으로 행하셨다 함을 듣고, 분심을 이기지 못하와 전죄를 무릅쓰고 천 리를 달려와 금릉에 이르러 자칭 충의장군이라 하옵고 필마단창으로 적군을 파하고 적장 묵특남과 동돌수를 베어 성상의 급하심을 구하옵고, 흉노가 도망하는 것을 따라 서릉도에 들어가 흉노를 베었나이다. 돌아오는 길에 해중에서 풍랑을 만나 나흘 밤낮을 정처 없이 가다가 천우신조하옵고, 성상의 하해지덕으로 무인절도에 다다라 바람이 그치오며, 그 섬에 올라가 죽었던 아비를 만났사오니 황명을 기다리지 아니하고 감히 함께 와 대죄하옵나니, 신의 부자의 죄 만 번 죽어도 아까울 것이 없나이다. 그러하오나 왕희는 국가의 난신적자요 신의 원수라. 뱃사람이 재물 없이 적소로 가는 죄수를 무단히 살해하올 일은 만무하온즉, 이는 반드시 왕희의 사주를 받은 것으로, 의심할 바 없는지라 바라옵건대 성상은 엄형 국문하옵신 후 왕적을 내어 주시고 신의 죄를 다스리옵소서.’ 하였더라. - 작자 미상, 이대봉전 - * 진진지연(秦晉之緣) : 혼인의 인연.","18. ㉠～㉤에 대한 설명으로 가장 적절한 것은? ① ㉠은 이대봉이 이릉의 영혼을 만나 갑옷과 칼을 얻은 공간이다. ② ㉡은 흉노가 침범한 곳이자 이대봉이 흉노를 처단한 공간이다. ③ ㉢은 장 한림 부부가 간신의 모해로 유배 간 공간이다. ④ ㉣은 이대봉이 중원으로 향하기 전에 머물던 공간이다. ⑤ ㉤은 동돌수가 이대봉을 피해 달아난 공간이다. 19. 장 소저에 대한 이해로 적절하지 않은것은? ① 부친과 이 시랑이 ‘진진지연’을 맺은 데에는 신기한 꿈이 영향을 미쳤을 것이라고 알고 있다. ② 이 시랑이 ‘간신의 모해’를 입은 것은 시운이 좋지 않았기 때문이라고 생각했다. ③ 부친이 ‘세상을 버’린 까닭은 혼약이 어그러진 것과 이 시랑의 죽음에 대한 분노 때문이라고 여겼다. ④ 왕희가 ‘혼인을 강제하’는 것으로 판단하여 변복 도주했다. ⑤‘성혼 행례’는 하지 않았으나, 승려가 된 양씨를 시어머니로 대했다. 20. <보기>의 [A]에 들어갈 말로 적절하지 않은것은? <보 기> 선생님: 고전 소설에서는 제문, 표문 등과 같은 다양한 글이 활용되기도 해요. 윗글의 ⓐ와 ⓑ에서 글을 바치는 사람과 받는 상대가 누구인지 고려하여, 글의 특징이나 기능에 대해 말해 보세요. 학 생: [A] 선생님: 네, 맞아요. ① ⓐ는 망자에게 바치는 제문이고, ⓑ는 성상에게 바치는 표문 이에요. ② ⓐ는 상대의 원통함을 위로하기 위하여, ⓑ는 상대에게 사건 경과를 알려 특별한 조치를 요청하기 위하여 작성되었어요. ③ ⓐ와 달리 ⓑ에는 글을 바치는 사람이 스스로를 낮추는 표현이 사용되었어요. ④ ⓐ에서 글을 바치는 사람이 오해했던 사건의 실상이 ⓑ에서 드러나고 있어요. ⑤ ⓐ와 ⓑ는 모두 글을 바치는 사람과 상대를 서두에서 밝히고 있어요. 21. <보기>를 참고하여 윗글을 감상한 내용으로 적절하지 않은 것은? [3점] <보 기> ｢이대봉전｣에서 주인공은 공적 가치와 사적 목표를 실현 하기 위해 노력한다. 공적 가치는 국가 차원의 사건에 참여 하는 당위로 제시되고, 사적 목표는 가문의 일원으로서 그 사건 해결에 가담하는 동력이 된다. 현실계나 비현실계의 존재들 또한 주인공의 이러한 문제 해결 과정에 조력한다. 공적 활약을 통해 공적 가치의 권위를 인정하는 이면에 사적 목표의 추구를 배치하는 이러한 구도는 영웅소설이 지향하는 ‘충’이라는 이념을 훼손하지 않으면서도 사적 목표의 추구를 정당화한다. ① 장애황이 혼약을 이루기 위해 대공을 세웠다고 한 데에서, 혼약이 국가 차원의 사건에 참여하는 동력이 되었음을 알 수 있군. ② 장애황이 난신 왕희를 국법으로 다스린 후 자신에게 내어 달라고 한 데에서, 공적 권위를 존중하되 사적 목표도 실현하고자 하는 마음을 알 수 있군. ③ 흉노의 침입으로 성상이 피신했다는 소식에 분노하여 이대봉이 출전한 데에서, 국가 차원의 문제 해결에 참여하는 당위성을 확인할 수 있군. ④ 표류하던 이대봉이 천우신조로 무인절도에서 이 시랑과 재회한 데에서, 비현실계의 존재가 이대봉의 공적 활약에 조력한 것을 확인할 수 있군. ⑤ 이대봉이 흉노 제압을 공으로 드러낸 후 성상에게 왕희의 처벌을 요구한 데에서, 충의 이념을 훼손하지 않으면서도 사적 목표의 정당성을 확보하려는 인물의 의중을 확인할 수 있군",고전소설,57.5
