T,Q,C,A
"(가) 저 건너 ⓐ 꽁생원은 팔자를 원망토다 제 아비 덕분으로 돈천이나 가졌더니 술 한 잔 밥 한 술을 친구 대접 하였던가 주제넘게 아는 체로 ㉠ 음양술수(陰陽術數) 현혹되어 이장도 자주 하며 이사도 힘을 쓰고 당대발복(當代發福) 예 아니면 피란처가 여기로다 올 적 갈 적 행로상에 ㉡ 처자식을 흩어 놓고 유무(有無) 상관 아니하고 공것을 바라도다 기인취물(欺人取物) 하자 하니 두 번째는 아니 속고 공납(公納) 범용 하자 하니 일가 중에 부자 없고 뜬재물을 경영하여 경향출입 싸다닐 제 재상가에 ㉢ 청질하다 봉변당해 물러서며 남의 고을 걸태 하다 혼금(?禁)에 쫓겨 오기 혼인 중매 선채* 돈에 창피당해 뺨 맞으며 가대* 흥정 구문 먹기 ㉣ 핀잔 듣고 자빠지고 불의행실(不義行實) 찌그렁이 위조문서 비리호송(非理好訟) 부자나 후려 볼까 ㉤ 감언이설 꾀어 보자 언막이에 보막이며 은광이며 금광이라 큰길가에 색주가며 노름판에 푼돈 떼기 남북촌에 뚜쟁이로 인물 초인(招引) 하여 볼까 산진매 수진매로 사냥질로 놀아나기 혼인 핑계 어린 딸이 백 냥짜리 되었구나 대종손 양반 자랑 산소나 팔아 볼까 아낙은 친정살이 자식은 머슴살이 일가에게 인심 잃고 친구에게 손가락질 부지거처(不知去處) 나간 후에 소문이나 들었던가 - 작자 미상, 우부가 - * 선채(先綵) : 혼례 전에 신랑 집에서 신부 집으로 보내는 비단. * 가대(家垈) : 집이나 토지 등을 통틀어 이르는 말. (나) 경인년(庚寅年)에 큰 가뭄이 들어 정월부터 가을 7월에 이르기 까지 비가 내리지 않았다. 봄에는 논밭을 갈지 못했고, 여름에는 김을 맬 수가 없었다. 들판에 있는 풀은 하나같이 누렇게 말랐고, 논밭의 곡식도 모두 시들었다. 부지런한 농부가 말하기를, “김을 매도 죽을 것이고 김을 매지 않아도 죽을 것이다. 편안히 앉아 기다리는 것보다는 힘을 다하여 곡식을 살리는 게 나을 것이다. 만일 비가 내린다면 어찌 그동안 들인 노력이 모두 허사가 되겠는가.”
라고 하였다. 그러므로 논밭은 이미 갈라졌으나 김매기를 그치지 아니하고 싹이 이미 시들었어도 풀 뽑기를 쉬지 아니하여, 한 해가 다 가도록 부지런히 일을 하면서 자신이 할 일에 최선을 다하였다. ⓑ 게으른 농부는 말하기를, “김을 매도 죽을 것이고 김을 매지 않아도 죽을 것이다. 바쁘게 일하면서 수고로운 것보다는 아무 일도 하지 않고 그냥
쉬는 것이 나을 것이다. 만일 비가 오지 않으면 이것 모두 무익하게 될 것이다.” 라고 하였다. 그러므로 밭에서 일하는 농부들을 보고 비웃기를 그치지 않았고, 들밥을 내가는 아녀자들을 보고 조롱하기를 그만두지 않으면서, 한 해가 다 가도록 물러나 앉아 천명을 기다리고 있었다. 나는 일찍이 가을걷이할 무렵 파산(坡山)의 들판에 가 보았다. 그 밭의 절반은 황폐하였고 절반은 곡식이 잘 가꾸어져 있었는데, 절반은 곡식이 성글게 달렸고 절반은 빽빽하게 달려 있었다. 어떤 농부는 목을 뻣뻣이 세우고 하늘을 우러러보고, 또 어떤 농부는 술에 취해 잠이 들어 있었다. 마을 노인에게 이유를 물으니, “저 황폐하고 성긴 곡식은 목을 뻣뻣이 세우고 하늘을 우러러 보는 자들이 무익하다고 여겨 김을 매지 않은 것이고, 잘 가꾸어져 빽빽한 곡식은 술에 취한 채 목이 메어 잠든 자들이 정성과 힘을 다하여 살린 것이다. 한때의 편안함을 탐내었다가 일 년 내내 굶주리게 되었고, 한때의 괴로움을 참아 일 년 내내 배불리 지낼 수 있게 되었다.” 라고 하였다. 아, 열심히 일하여 얻고, 편안하게 놀다가 잃는 것은 비단 농사일만이 아닐 것이다. 오늘날 시서(詩書)를 공부하여 벼슬길에 나아가기를 도모하는 사람들도 어찌 이와 다를 것인가? ⓒ선비들은 젊었을 때에 학문에 뜻을 두고 밤낮없이 부지런히 노력하여 육경(六經)과 온갖 사서(史書)를 탐구하지 않음이 없고 문장과 아름다운 글귀를 익히지 않음이 없다. 저마다 재주를 품고 기이한 재주를 쌓아 과거 시험장에 나아가 솜씨를 겨루어,
한 번에 뜻을 이루지 못하면 못마땅해하고, 두 번에 뜻을 얻지 못하면 마음이 흐려지고, 세 번에도 뜻을 얻지 못하면 스스로 낙심하여 말하기를, “공명에는 분수가 있어서 학문으로 이룰 수 있는 것이 아니며, 부귀는 운명에 달려 있으니 역시 학문으로 이룰 수 있는 것이 아니다.” 라고 한다. 그동안 배운 것을 버리고 아울러 이전에 쌓아 온
바를 버려서 어떤 이는 중도에 그만두기도 하고 또 어떤 이는 문(門)에 거의 다 이르렀다가 되돌아간다. 아홉 길 높이로 산을 쌓고도 한 삼태기의 힘을 마저 쏟지 않는 것과 같으니, 어찌 게을러서 김을 매지 않는 자들과 같지 않으리오. 학문의 수고로움은 농부들이 봄, 여름, 가을의 세 계절을 고생하는 것에 비할 바가 아니나, 학문을 하여 얻는 공이 어찌 농사를 지어 얻는 이로움 정도뿐이겠는가. 농사를 지어 입과 배를 채우는 것은 그 이로움이 적으나, 학문을 하여 명성을 취하는 것은 그 이로움이 크다. 이로움이 작은 일도 오히려 부지런히 하지 않을 수 없는데, 하물며 큰 일을 하면서 부지런하지 않을 수 있겠는가. 마음을 수고롭게 하는 군자는 도리어 몸을 수고롭게 하는 소인이 끝까지 노력함을 알지 못한다. 그러므로 이 글을 지어 그들을 깨우치는 바이다. - 성현, 타농설 -","22. (가)와 (나)에 대한 설명으로 가장 적절한 것은? ①(가)는 열거의 방식을, (나)는 대조의 방식을 활용하여 주제를 부각하고 있다. ②(가)는 (나)와 달리, 대구적 표현을 활용하여 인물에 대한 태도의 변화를 드러내고 있다. ③(나)는 (가)와 달리, 반어적 표현을 활용하여 인물에 대한 기대감을 높이고 있다. ④(가)와 (나)는 모두, 계절적 배경을 활용하여 향토적 분위기를 조성하고 있다. ⑤(가)와 (나)는 모두, 해학적 표현을 활용하여 인물 간의 우호적 관계를 드러내고 있다. 23. ㉠～㉤을 이해한 내용으로 적절하지 않은것은? ① ㉠은 집터나 묏자리를 통해 길운을 바라는 꽁생원이 관심을 보이는 대상이다. ② ㉡은 재물을 모은 꽁생원이 함께 풍요로운 삶을 누리고 싶은 대상이다. ③ ㉢은 재물을 경영하여 부를 증식하려는 꽁생원이 권력가의 권세를 이용하기 위한 방법이다. ④ ㉣은 집이나 땅을 중개하여 이문을 취하려는 꽁생원이 흥정 과정에서 겪은 부정적 반응이다. ⑤ ㉤은 부자의 재산으로 이익을 얻으려는 꽁생원이 부자를 꾀는 수단이다. 24. ⓐ～ⓒ에 대한 이해로 가장 적절한 것은? ① ⓐ는 도박과 음주에 빠져 있고, ⓑ는 파산의 들판에서 술에 취해 잠들어 있다. ② ⓐ는 부모의 혜택을 받지 못하여 팔자를 원망하고, ⓒ는 분수를 알아 자신의 배움에 한계가 있다고 생각한다. ③ ⓐ는 혼인을 중매하는 일에 성공하지 못하여 창피를 당하고, ⓒ는 과거 시험에서 뜻을 이루지 못하여 수치를 당한다. ④ ⓑ는 가뭄에 김을 매지 않아 다른 농부들의 조롱을 받고, ⓒ는 한때의 괴로움을 참지 못하여 공명을 이루지 못한다. ⑤ ⓑ는 김매기를 하여도 작물이 죽을 것이라고 생각하고, ⓒ는 학문에 힘을 쏟아도 부귀를 이루지 못할 수 있다고 생각한다. 25. (나)에 대한 설명으로 적절하지 않은것은? ① 인물들의 말을 인용하여 특정 상황에 대한 서로 다른 태도를 드러내고 있다. ② 글쓴이의 주장과 그에 대한 반박을 제시하여 화제에 대한 상반된 입장을 나타내고 있다. ③ 물음에 답하는 인물을 통해 글쓴이가 관찰한 상황이 발생하게 된 이유를 제시하고 있다. ④ 다른 사람에게 교훈을 전달하고자 하는 글쓴이의 의도를 드러내며 글을 마무리하고 있다. ⑤ 글쓴이의 경험을 통해 얻은 깨달음을 바탕으로 논의의 대상을 다른 상황으로 확장하고 있다. 26. <보기>를 참고하여 (가), (나)를 감상한 내용으로 적절하지 않은 것은? [3점] <보 기> 당면한 현실에 대응하는 양상에 따라 삶에 대한 평가는 달라진다. 요행을 바라면서 책임감 없는 삶을 사는 경우에는 부정적으로, 현실적 한계를 극복하고자 노력하는 삶을 사는 경우에는 긍정적으로 평가된다. (가)에서는 당대 규범에서 벗어나 세속적 욕망을 추구하며 요행을 바라는 태도에 대한 경계가, (나)에서는 운명론적 태도에서 벗어나 삶의 주체로서 문제를 성실하게 해결하는 자세에 대한 권면이 나타나고 있다. ①(가)의 ‘공것’과 ‘뜬재물’은 정당한 노력을 기울이지 않고 요행을 바라는 태도를 알 수 있는 소재이군. ②(나)의 ‘비가 내리지 않’아 ‘김을 맬 수가 없’는 것을 보니, 농부들이 농경에 부적합한 환경이라는 문제 상황에 당면하게 된 것을 알 수 있군. ③(가)의 ‘공납’을 유용하려는 것에서 이익을 위해 규범을 무시하는 태도를, (나)의 ‘그냥 쉬는 것이 나을 것’에서 불행한 결과를 예단하는 운명론적 태도를 확인할 수 있군. ④(가)의 ‘돈천이나 가졌더니’, ‘친구 대접 하였던가’에서 재물을 베푸는 데 인색한 물욕을, (나)의 ‘풀 뽑기를 쉬지 아니하여’에서 한계 상황을 극복하고자 하는 의지를 확인할 수 있군. ⑤(가)의 ‘일가’와 ‘친구’에게서 소외당한 꽁생원의 말로에서 무책임한 삶에 대한 경계가, (나)의 ‘큰 일을 하면서 부지런하’기를 촉구하는 데에서 게으른 농부에 대한 권면이 나타나는군.",갈래복합,70.8
"어머니의 변명은 끝끝내 내 마음을 어루만져 주지 못했다. 그 후로 나는 좀처럼 아버지에 대한 얘기를 꺼내지 않게 되었다. 뜻밖에도 아버지의 죄를 순순히 시인하는 그녀의 ⓐ 한마디가 내게는 그토록 엄청난 충격으로 깊이 남겨졌던 탓이리라. ㉠바로 그 순간부터 나는 아버지의 그 죄라는 것을 내 스스로 함께 나누어 지니고 만 느낌이었고, 그 때문에 나이에 걸맞지 않게 나는 눈빛이 깊고 어두운 아이가 되어 가고 있었다. 그리고 그때부터 아버지의 무서운 환영은 저주처럼 내 곁을 따라다니기 시작했다. 그는 언제나 시커먼 어둠 저편에 숨어서 음산하기 그지없는 눈빛으로 나를 쏘아보고 있었다. 그는 어디에나 숨어 있었다. 내 어릴 때 이따금 고개를 디밀어 들여다보면 마루 밑 저편 깊숙이 도사리고 있던 그 까마득한 어둠 속에도 그 어둠 속에서 술술 기어 나오던 그 눅눅하고 음습한 냄새 속에서도 내가 한 번도 얼굴을 본 적이 없는 그 사내는 핏발 선 눈알을 번득이며 나를 쏘아보고 있는 것이었다. 그건 어디서 묻었는지도 모르는, 오랜 시간이 흐른 뒤에까지 지워지지 않는 핏자국처럼 내게는 저주와 공포의 낙인으로 깊이 박혀져 있었다. 그리고 그 낙인을 가슴에 지닌 채, 나는 끝끝내 나를 휘감고 있는 어떤 엄청난 죄악감과 불길한 예감으로부터 영영 벗어날 수가 없었다. [중략 부분의 줄거리] 나와 부대원들은 훈련에 대비해 참호를 파다가 발견한 유해를 인근 마을의 노인과 함께 수습하여 매장하는 일을 행한다. 두개골과 다리뼈를 꼼꼼히 문질러 닦은 뒤, 노인은 몸통뼈에 묶인 줄을 풀어내기 시작했다. 완강하게 묶인 매듭은 마침내
노인의 손끝에서 풀리어졌다. 금방이라도 쩔걱쩔걱 쇳소리를 낼 듯한 철삿줄은 싱싱하게 살아 있었다. 살을 녹이고 뼈까지도 녹슬게 만든 그 오랜 시간과 땅 밑의 어둠을 끝끝내 견뎌 내고 그렇듯 시퍼렇게 되살아 나오는 그것의 놀라운 끈질김과 냉혹성이 언뜻 소름끼치도록 무서움증을 느끼게 했다. 노인은 손목과 팔에 묶인 결박까지 마저 풀어낸 다음 허리를 펴고 일어서더니 줄 묶음을 들고 저만치 걸어 나갔다. 그가 허공을 향해 그것을 멀리 내던지는 순간 나는 까닭 모르게 마당가에서 하늘을 치어다보며 서 있는 어머니의 가녀린 목 줄기와 그녀가 아침마다 소반 위에 떠서 올리곤 하던 하얀 물 사발이 눈앞에 떠올랐다가 스러져 버리는 것이었다. ㉡ 나는 담배를 피워 물었다. 멀리 메마른 초겨울의 야산이 헐벗은 등을 까 내놓고 죽은 듯이 엎드려 있었다. 사위는 온통 잿빛의 풍경이었다. 피잉, 현기증이 일었다. 광주리를 머리에 인 어머니가 모래밭을 걸어오고 있었다. 돌돌거리며 흐르는 물소리를 거슬러 강변 모래밭을 어머니가 혼자 저만치서 다가오고 있었다. 모래밭은 하얗게 햇살을 되받아 쏘며 은빛으로 반짝였다. 허리띠를 질끈 동인 어머니의 치맛자락이 흐느적이며 바람결에 흔들리고 있었다. 나는 햇살에 부신 눈을 가늘게 오므리고 줄곧 그녀를 지켜보고 있었다. 그때였다. 꿈속에서 처럼 나는 그녀의 뒤를 바짝 따라오고 있는 한 사내의 환영을 보았다. 그건 아버지였다. ㉢ 언젠가 어머니의 낡은 반닫이 깊숙한 옷가지 밑에 숨겨져 있던 액자 속에서 학생복 차림으로 서 있던 그대로 그건 영락없는 그 사내였다. 나를 어머니의 배 속에 남겨 놓은 채 어느 바람이 몹시 부는 날 밤, 산길을 타고 지리산인가 어디로 황황히 떠나가 버렸다는 사내. 창백해 뵈는 뺨에 마른 몸집의 그 사내가 어머니와 함께 걸어오고 있는 것이었다. 놀란 눈으로 풀밭에 앉아 나는 그들을 지켜보고 있었다. 이윽고 어머니의 눈썹과 코, 입의 윤곽과 야윈 목 줄기까지 뚜렷이 드러날 만큼 가까워졌을 때 사내의 환영은 어느 틈에 사라져 버리고 없었다. 몇 번이나 눈을 비비고 보았으나 역시 마찬가지였다. 하얗게 반짝이는 모래밭 위로 어머니가 찍어 내는 발자국만 유령처럼 끈질기게 그녀의 발꿈치를 뒤따라오고 있을 뿐이었다. 우리는 관 대신에 신문지로 싼 유해를 맨 처음 그 자리에 다시 묻어 주었다. 도톰하니 봉분을 만들고 뗏장까지 입혀 놓고 보니 엉성한 대로 형상은 갖춘 듯싶었다. 노인은 술을 흙 위에 뿌려주었다. 그리고 자신이 먼저 한 모금 마신 다음에 잔을 돌렸다. 오 일병이 노파가 준 북어를 내놓았고, 덕분에 작은 술판이 벌어졌다. 음복인 셈이었다. “얌마, 이런 느닷없는 장례식도 모두 너희 두 놈들 때문이니까, 자 한 잔씩 마셔라.” “그래그래, 어쨌든 너희들은 좋은 일 했으니 천당 가도 되겠다.” 소대장이 병을 기울였고 다른 녀석들도 낄낄대며 ⓑ한마디씩 보태었다. 술이 가득 차오른 반합 뚜껑을 나는 두 손으로 받쳐 들었다. ㉣ 저것 봐라이. ㉮ 날짐승도 때가 되면 돌아올 줄 아는 법이다. 어머니가 말했다. 저만치 웬 사내가 서 있었다. 가슴과 팔목에 철삿줄을 동여맨 채 사내는 이쪽을 응시하며 구부정하게 서 있었다. 퀭하니 열려 있는 그 사내의 눈은 잔뜩 겁에 질려 있는 채로였다. 애앵. 총성이 울렸고 그는 허물어지듯 앞으로 고꾸라지고 있었다. ㉤ 불현듯 시야가 부옇게 흐려 왔다. 아아. 아버지는 지금 어디에 쓰러져 누워 있을 것인가. 해마다 머리맡에 무성한 ㉯쑥부쟁이와 엉겅퀴꽃을 지천으로 피워 내며 이제 아버지는 어느 버려진 밭고랑, 어느 응달진 산기슭에 무덤도 묘비도 없이 홀로 잠들어 있을 것인가. - 임철우, 아버지의 땅 -
","27. ㉠～㉤의 서술 방식에 대한 설명으로 적절하지 않은것은? ① ㉠: ‘나’의 지각 내용을 ‘나’가 서술하는 상황으로 인물과 서술자가 겹쳐 있다. ② ㉡: 서술의 주체를 알 수 있는 표지가 분명하게 제시되어 서술자와 지각의 주체가 뚜렷이 구분된다. ③ ㉢: ‘나’가 아니라 ‘나’가 지각하는 대상을 주어로 서술함으로써 지각의 대상을 부각하는 효과가 나타난다. ④ ㉣: 인용 부호 없이 서술된 발화에서 인물의 목소리가 드러 난다. ⑤ ㉤: 지각의 주체를 알리는 표지가 나타나지 않아서 누가 지각한 바를 서술한 것인지 모호한 상황이 빚어진다. 28. 윗글에서 ⓐ와 ⓑ의 서사적 기능에 대한 설명으로 가장 적절한 것은? ① ⓐ가 이야기의 심화된 주제를 구현하는 제재라면, ⓑ는 이야기의 주제를 가늠하도록 하는 단서이다. ② ⓐ가 이야기를 절정에 치닫도록 하는 추진력이라면, ⓑ는 이야기를 결말에 이르게 하는 원동력이다. ③ ⓐ가 이야기의 긴장감이 형성되는 요인이라면, ⓑ는 이야기의 긴장감이 완화됨을 드러내는 표지이다. ④ ⓐ가 이야기의 위기감이 해소된 종착점이라면, ⓑ는 이야기의 위기감이 고조된 정점이다. ⑤ ⓐ가 이야기를 일으키는 시발점이라면, ⓑ는 이야기의 전모가 드러나게 되는 귀결점이다. 10 20 이 문제지에 관한 저작권은 한국교육과정평가원에 있습니다. 11 29. ㉮와 ㉯에 대한 이해로 가장 적절한 것은? ① ㉮는 ㉯에 비해 능동적이므로 인물이 처한 문제 상황에 미치는 영향력이 크다. ② ㉮는 ㉯와 달리, 시간과 공간에 관여되면서 이야기의 배경에 실감을 더하게 된다. ③ ㉯는 ㉮와 달리, 희망적인 성격이 강하므로 인물이 원하는 바를 집약한 결과이다. ④ ㉯에서 연상되는 상황이 현실이 될 경우 ㉮에 투영된 염원은 실현 가능성이 사라진다. ⑤ ㉮와 ㉯ 모두, 관념적 의미가 부여됨으로써 인물이 이념에 편향되어 있음이 알려진다. 30. <보기>를 참고하여 윗글을 감상한 내용으로 적절하지 않은 것은? [3점] <보 기> 부정적인 방향으로 응고된 기억을 돌이켜 긍정적인 방향 으로 재편함으로써 심리적 안정을 도모하는 기회를 마련할 수 있다. 심리 요법의 일환으로 적용되는 ‘기억 재응고화’는 마음의 상처로 남은 기억을 재구성하여 다른 의미와 가치에 대응시킴으로써, 사람들로 하여금 부정적 기억으로 빚어진 심리적 불안정에 대응할 힘을 회복하도록 돕는 원리이다. ①‘낙인’과도 같은 유년의 기억을 성인이 되어서도 떨쳐 버리지 못했다는 고백에 비추어 보면, 응고된 기억의 영향력에서 벗어나는 일이 쉽지 않음을 짐작할 수 있겠군. ②‘죄악감과 불길한 예감’을 유발한 동인을 추적해 보면, ‘아버지’에 관한 기억이 마음의 상처로 남음으로써 ‘나’의 심리적 불안정이 비롯되고 있음을 추정할 수 있겠군. ③‘줄 묶음’을 ‘내던지’는 ‘노인’의 행위와 ‘물 사발’을 올리는 ‘어머니’의 행위가 이어지며 제시되는 부분을 보면, ‘나’의 기억을 재응고화하기 위한 이들의 노력을 확인할 수 있겠군. ④‘모래밭’에서의 ‘어머니’ 형상과 ‘사내의 환영’이 어우러지는 장면에서, ‘아버지’에 대해 굳어져 있던 기억이 재편될 수 있는 가능성이 시사된다고 할 수 있겠군. ⑤‘아버지’에 대한 이미지가 ‘유해’에 대응되면서 ‘나’의 정서적 반응에 변화가 생기는 것을 보면, 부정적인 기억을 재구성함 으로써 심리적 안정을 회복해 가는 경위를 엿볼 수 있겠군.",현대소설,58
