T,Q,C,A
"여러 글에서 다양한 정보를 종합하며 읽는 능력은 많은 정보가 산재해 있는 디지털 환경에서 더욱 중요해졌다. 궁금증 해소나 글쓰기 등 문제 해결을 위한 목적으로 글 읽기를 할 때에 한 편의 글에 원하는 정보가 충분하지 않다면, 여러 글을 읽으며 이를 해결할 수 있다. 독자는 우선 문제 해결에 도움이 되는 글들을 찾아야 한다. 읽을 글을 선정할 때에는 믿을 만한 글인지와 읽기 목적과 관련이 있는 글인지를 평가하는 것이 중요하다. ㉠ 신뢰성 평가는 글의 저자, 생산 기관, 출판 시기 등 출처에 관한 정보를 확인하여 그 글이 믿을 만한지 판단하는 것이다. ㉡ 관련성 평가는 글의 내용에 읽기 목적과 부합하는 정보가 있는지 판단하는 것인데, 이를 위해서는 읽기 목적을 지속적으로 떠올리며 평가해 가야 한다. 문제를 해결하기에 적절한 글들을 선정했다면, 다음으로는 읽기 목적에 맞게 글을 읽어야 한다. 이때 글의 정보는 독자가 이해한 의미로 재구성되고 이 과정에서 독자는 선택하기, 연결 하기, 조직하기 전략을 활용한다. 이들 세 전략은 꼭 순서대로 사용하는 것은 아니며 반복해서 활용할 수 있다. 선택하기란 읽은 글에서 필요한 정보를 추출하는 전략이다. 연결하기란 읽은 글들에서 추출한 정보들을 정교화하며 연결하여, 읽은 글에서는 나타나지 않던 의미를 구성하거나 심화된 의미로 나아가는 전략이다. 글의 정보를 재구조화하는 것은 조직하기 라고 한다. 예를 들어, 시간의 순서에 따른 글과 정보 나열의 글을 읽고, 읽은 글의 구조와는 다른 비교?대조의 구조로 의미를 구성할 수 있다. 이러한 전략을 적극적으로 활용하면, 정보의 홍수 속에서 유용한 정보를 찾아 삶의 여러 문제를 해결하는 데에도 도움이 될 것이다.","1. 윗글의 내용과 일치하지 않는 것은? ① 글을 선정하는 과정에서 글을 평가하는 것은 중요하다. ② 여러 글 읽기에서 정보를 연결하는 것은 문제 해결에 유용한 방법이 될 수 있다. ③ 궁금증을 해소하기 위한 읽기에서 글의 의미를 재구성하는 전략이 사용될 수 있다. ④ 여러 글에서 필요한 정보를 추출하는 과정은 문제를 해결하기 위한 읽기 목적과 관련된다. ⑤ 필요한 정보를 한 편의 글에서 얻지 못할 때는 다른 글을 찾기 보다 그 글을 반복해서 읽는다. 2. ㉠, ㉡에 대한 설명으로 가장 적절한 것은? ① 글 내용이 수행 과제와 관련 있는지 평가하는 것은 ㉠에 해당한다. ② 읽을 글을 선정하기 위해 출판사의 공신력을 따지는 것은 ㉠을 고려한 것이다. ③ ㉡에서는 글이 언제 작성되었는지를 중심으로 판단해야 한다. ④ 정보가 산재해 있는 디지털 환경에서는 ㉠의 필요성이 사라 지고 ㉡에 대한 요청이 증가한다. ⑤ 글 내용에 목적에 맞는 정보가 있는지 확인하는 것은 ㉠에, 저자의 경력 정보를 확인하는 것은 ㉡에 관련된다. 3. 다음은 여러 글 읽기를 수행한 학생의 독서록이다. 윗글을 참고하여 ⓐ～ⓔ에 대해 이해한 내용으로 적절하지 않은 것은? [3점] ① ⓐ : <동물은 예술가>를 읽으며 선택하기 전략을 활용했겠군. ② ⓑ : <동물에게 상속할 수 있는가>를 읽으며 연결하기 전략에 앞서 조직하기 전략을 활용했겠군. ③ ⓒ : <동물은 예술가>와 <동물에게 상속할 수 있는가>를 읽으며 선택한 정보들로 연결하기 전략을 활용했겠군. ④ ⓓ : 새로운 구조로 정리하여 의미를 구성하기 위해 조직하기 전략을 활용했겠군. ⑤ ⓔ : <동물에게 상속할 수 있는가>를 읽으며 선택하기 전략을 다시 활용했겠군.",독서이론,91.6
"정당과 같은 정치 조직이 민주적 방식과 절차로 운영되어야 하는 것은 당연하다. 그런데 민주적 운영 체제를 갖추었으면서도 실제로는 일부 소수에게 권력이 집중되어 있는 경우도 적지 않다. 조직 운영에서 보이는 이러한 현상을 흔히 과두제라 한다. 이는 정치 조직에서뿐만 아니라 기업 경영에서도 나타난다. 모든 주주가 경영진을 이루어 상호 협력 관계를 기반으로 기업을 운영하며 의사 결정권도 균등하게 행사하는 경우에 이를 ‘공동체적 경영’이라 부르기도 한다. 이런 기업에서 경영진은 모두 업무와 관련하여 전문성을 가지며, 경영 수익에 관련된 중요한 사항은 주주들이 공동으로 결정한다. 그러나 기업의 규모가 성장하고 사업이 다양해지면, 소수의 의사 결정에 따른 수직적 경영으로 효율성을 지향하는 ‘과두제적 경영’으로 나아가는 일도 있다. 과두제적 경영 은 소수의 경영자로 이루어진 경영진이 강한 결속력을 가지면서 실질적 권한과 정보를 독점하며 기업을 운영하는 것을 말한다. 이런 체제는 전문성과 경험을 갖춘 경영진을 중심으로 안정적 경영권이 확보될 수 있도록 하여, 기업 전략을 장기적으로 수립하고, 이에 맞춰 과감하고 지속적인 투자를 할 수 있어서 첨단 핵심 기술의 개발에도 유리한 면이 있다. 그리고 기업과 경영진 간의 높은 일체성은 위기 상황에서 신속한 의사 결정으로 효율적인 대처를 하는 데 도움을 주기도 한다. 그런데 대체로 주주의 수가 많으면 개별 주주의 결정권은 약하고, 소수의 경영진이 기업을 장악하는 힘은 크다. 이를 이용하여 정보와 권한이 집중된 소수의 경영진이 사익에 치중하면 다수 주주의 이익이 침해되는 폐해가 나타날 수 있다. 경영 성과를 실제보다 부풀려 투자를 유치한 뒤 주주들에게 회복하기 어려운 손해를 입히는 경우도 있으며, 기업 운영에 중대한 영향을 미치는 주요 정보들을 은폐하거나 경영 상황을 조작하여 발표함으로써 결과적으로 기업의 가치에 심각한 타격을 주는 사례도 종종 보게 된다. 이러한 문제점을 완화하기 위해 기업이 경영자와 계약을 체결하여 급여 이외의 경제적 이익을 동기로 부여하는 방안이 있다. 예를 들면, 일정 수량의 주식을 계약 시에 정한 가격으로 미래에 매수할 수 있도록 하는 스톡옵션의 권리를 경영자에게 부여하는 방식이 있다. 이 권리를 행사할지 말지는 자유이고, 경영자는 매수 시점을 유리하게 선택할 수 있다. 또 아직 우리 나라에 도입되지는 않았지만, 기업의 주식 가치가 목표치 이상 으로 올랐을 때 경영자가 그에 상응하는 보상을 받는 주식 평가 보상권의 방식도 있다. 기업 경영의 건전성을 확보하기 위해 마련된 공적 제도들은 과두제적 경영의 폐해를 방지하는 기능도 한다. 기업의 주식 가치에 영향을 미칠 수 있는 정보 제공을 법적으로 의무화한 경영 공시 제도는 경영 투명성을 높이려는 것이다. 이를 통해 경영진과 주주들 간 정보 격차가 줄어들 수 있다. 기업의 이사회에 외부 인사를 이사로 참여시키도록 하는 사외 이사 제도는 독단적인 의사 결정을 견제함으로써 폐쇄적 경영으로 인한 정보와 권한의 집중을 억제하는 효과를 거둘 수 있다.","4. 윗글의 내용 전개 방식으로 가장 적절한 것은? ① 대상의 개념과 장단점을 제시하고 보완책을 소개한다. ② 유사한 원리들을 분석하고 이를 하나의 이론으로 통합한다. ③ 대립하는 유형을 들어 이론적 근거의 변천 과정을 설명한다. ④ 가설을 세우고 그에 대해 현실적인 사례를 들어 가며 검토한다. ⑤ 문제 상황의 근본 원인을 진단하고 해결책에 대한 상반된 입장을 해설한다. 5. 과두제적 경영에 대한 이해로 적절하지 않은것은? ① 소수의 경영진이 내린 의사 결정이 수직적으로 집행되는 효율성을 추구한다. ② 강한 결속력을 가진 소수의 경영자로 경영진을 이루어 경영권 유지에 강점이 있다. ③ 경영권이 안정되어 중요 기술 개발에 적극적인 투자를 계속 하는 데에 유리하다는 장점이 있다. ④ 경영진이 투자자의 유입을 유도하기 위하여 경영 성과를 부풀릴 위험성이 있어 이에 대비할 필요가 있다. ⑤ 경영진과 다수 주주 사이의 이해가 일치하는 경우에는 그렇지 않은 경우보다 기업 가치가 훼손될 위험성이 높아진다. 6. 윗글을 읽고 추론한 내용으로 적절하지 않은것은? ① 스톡옵션의 권리를 가진 경영자는 주식 가격이 미리 정해 놓은 것보다 하락하더라도 손실을 입지 않을 수 있다. ② 스톡옵션은 경영자의 성과 보상에 미래의 주식 가치가 관련 된다는 점에서 주식 평가 보상권과 차이가 있다. ③ 경영 공시는 주주가 기업 경영 상황을 파악하여 기업 가치를 평가하는 데 유용한 제도가 될 수 있다. ④ 사외 이사 제도는 기업의 의사 결정에 외부 인사를 참여시켜 경영의 개방성을 높일 수 있는 제도라 평가할 수 있다. ⑤ 경영 공시 제도와 사외 이사 제도는 기업의 중요 정보에 대한 경영진의 독점을 완화할 수 있다. 2 20 이 문제지에 관한 저작권은 한국교육과정평가원에 있습니다. 3 7. 윗글을 바탕으로 <보기>를 이해한 내용으로 가장 적절한 것은? [3점] <보 기> X사는 정밀 부품 분야에서 독보적인 기술을 장기간 보유 하여 발전시켜 온 기업으로서 시장 점유율도 높다. 원래 X사의 주주들은 모두 함께 경영진이 되어 중요 사항에 대하여 동등한 결정권을 보유하였으나, 기업이 성장하면서 효율성 증진을 위하여 소수의 주주만으로 경영진을 구성하였다. 경영진은 주기적으로 다른 주주들로 교체되어 전체 주주는 기업의 경영 상태를 파악할 수 있으며, 경영 이익의 분배와 같은 주요 사항은 전체 주주가 공동으로 의결한다. X사의 주주 A와 B는 회사의 진로에 관하여 다음과 같은 대화를 나누었다. A: 최근 치열해진 경쟁에 대응하려면, 경영진의 구성원을 변동시키지 않고 경영 결정권도 경영진이 전적으로 행사 하도록 하는 게 좋겠습니다. B: 시장 점유율도 잘 유지되고 있고 우리 주주들의 전문성도 탁월하니, 예전처럼 회사를 운영한다고 하더라도 문제없을 듯합니다. ①X사는 주주들 사이의 평등성이 강하여 과도한 정보 격차나 권한 집중과 같은 폐해를 보이지 않는다. ②X사는 현재 경영진이 고정되는 구조로 바뀌었지만 주주가 실적에 대한 이익 분배를 결정할 수 있기 때문에 수직적 경영의 부작용은 나타나지 않는다. ③A는 결속력이 강한 소수의 경영진을 중심으로 운영되는 경영 방식을 현행대로 유지하여야 시장의 점유율을 지킬 수 있다고 보는 입장이다. ④B는 수평적인 의사 결정 구조로의 전환을 최소한으로 하여 효율적 경영을 유지해야 한다고 보는 입장이다. ⑤A와 B는 현재 X사가 경험과 전문성을 바탕으로 안정적인 과두제적 경영을 하고 있다는 전제에서 논의를 한다",사회,69.5
"식품 포장재, 세제 용기 등으로 사용되는 플라스틱은 생활에서 흔히 ⓐ 접할 수 있다. 플라스틱은 ‘성형할 수 있는, 거푸집으로 조형이 가능한’이라는 의미의 ‘플라스티코스’라는 그리스어에서 온 말로, 열과 압력으로 성형할 수 있는 고분자 화합물을 이른다. 플라스틱은 단위체인 작은 분자가 수없이 반복 연결되는 중합을 통해 만들어진 거대 분자로 이루어져 있다. 단위체들은 공유 결합으로 연결되는데, 분자를 구성하는 원자들이 서로 전자를 공유하여 안정한 상태가 되는 결합을 공유 결합이라 한다. 두 원자가 각각 전자를 하나씩 내어놓아 그 두 개의 전자를 한 쌍으로 공유하면 단일 결합이라 하고, 두 쌍을 공유하면 이중 결합이라 한다. 공유 전자쌍이 많을수록 원자 간의 결합력은
강하다. 대부분의 원자는 가장 바깥 전자 껍질의 전자 수가 8개가 될 때 안정해진다. 탄소 원자는 가장 바깥 전자 껍질에 4개의 전자를 갖고 있어, 다른 원자들과 전자를 공유하여 안정 해질 수 있으며 다양한 형태의 공유 결합이 가능하여 거대한 분자의 골격을 이룰 수 있다. 플라스틱의 한 종류인 폴리에틸렌은 에틸렌 분자들이 서로 연결되는 중합 과정을 거쳐 만들어진다. 에틸렌은 두 개의 탄소 원자와 네 개의 수소 원자로 이루어지는데, 두 개의 탄소 원자가 서로 이중 결합을 하고 각각의 탄소 원자는 두 개의 수소 원자와 단일 결합을 한다. 탄소 원자 간의 이중 결합에서는 한 결합이 다른 하나보다 끊어지기 쉽다. 에틸렌의 중합에는 여러 가지 방법이 있는데 그중에 하나는 과산화물 개시제를 사용하는 것이다. 열을 흡수한 과산화물 개시제는 가장 바깥 껍질에 7개의 전자가 있는 불안정한 상태의 원자를 가진 분자로 분해된다. 이 불안정한 원자는 안정해지기 위해 에틸렌이 가진 탄소의 이중 결합 중 더 약한 결합을 끊어 버리면서 에틸렌의 한쪽 탄소 원자와 전자를 공유하며 단일 결합 한다. 그러면 다른 쪽 탄소 원자는 공유되지 못한, 홀로 남은 전자를 갖게 된다. 이 불안정한 탄소 원자는 같은 방식으로 다른 에틸렌 분자와 반응을 하게 되고, 이와 같은 반응이 이어지며 불안정해지는 탄소 원자가 계속 생성된다. 에틸렌 분자들이 결합하여 더해지면 이것들은 사슬 형태를 이루며, 이 사슬은 지속적으로 성장하고 사슬 끝에는 불안정한 탄소 원자가 존재하게
된다. 성장하는 두 사슬의 끝이 서로 만나 결합하여 안정한 상태가 되면 반복적인 반응이 멈추게 된다. ㉠ 이 중합 과정을 거쳐 에틸렌 분자들은 폴리에틸렌이라는 고분자 화합물이 된다. 플라스틱을 이루는 거대한 분자들은 길이가 길다. 그래서 사슬들이 일정한 방향으로 나란히 배열되어 있는 결정 영역은, 분자들 전체에서 기대할 수는 없지만 부분적으로 있을 수는 있다. 플라스틱에서 결정 영역이 차지하는 부분의 비율은 여러 조건에 따라 조절이 가능하고 물성에 영향을 미친다. 결정 영역이 많아질수록 플라스틱은 유연성이 낮아 충격에 약하고 가공성이 떨어지며 점점 불투명해지지만, 밀도가 높아져 단단해지고 화학 물질에 대한 민감성이 감소하며 열에 의해 잘 변형되지 않는다.
이런 성질을 활용하여 필요에 따라 다양한 종류의 플라스틱을 만들 수 있다.",8. 윗글에서 알 수 있는 내용으로 적절하지 않은것은? ① 단위체들은 중합을 거쳐 거대 분자를 이룰 수 있다. ② 에틸렌 분자에는 단일 결합과 이중 결합이 모두 존재한다. ③ 플라스틱이라는 명칭의 유래는 열과 압력으로 성형이 되는 성질과 관련이 있다. ④ 불안정한 원자를 가진 에틸렌은 과산화물을 개시제로 쓰면 분해되면서 안정해진다. ⑤ 탄소와 탄소 사이의 이중 결합 중 하나의 결합 세기는 나머지 하나의 결합 세기보다 크다. 3 20 이 문제지에 관한 저작권은 한국교육과정평가원에 있습니다. 4 9. ㉠에 대한 이해로 적절하지 않은것은? ① 성장 중의 사슬은 그 양쪽 끝부분에서 불안정한 탄소 원자가 생성된다. ② 사슬의 중간에 두 탄소 원자가 서로 전자를 하나씩 내어놓아 공유하는 결합이 존재한다. ③ 상태가 불안정한 원자를 지닌 분자의 생성이 연속적인 사슬 성장 반응이 일어나는 계기가 된다. ④ 공유되지 못하고 홀로 남은 전자를 가진 탄소 원자는 사슬의 성장 과정이 종결되기 전까지 계속 발생한다. ⑤ 에틸렌 분자를 구성하는 탄소 원자들 사이의 이중 결합이 단일 결합으로 되면서 사슬의 성장 과정을 이어 간다. 10. 윗글을 바탕으로 <보기>의 ㉮와 ㉯를 이해한 내용으로 가장 적절한 것은? [3점] <보 기> 폴리에틸렌은 높은 압력과 온도에서 중합되어 사슬이 여기저기 가지를 친 구조로 만들어지기도 한다. ㉮가지를 친 구조의 사슬들 은 조밀하게 배열되기 힘들다. 한편 특수한 촉매를 사용하여 저온에서 중합되면 탄소 원자들이 이루는 사슬이 한 줄로 쭉 이어진 직선형 구조로 만들어지기도 한다. 이 ㉯직선형 구조의 사슬들은 한 방향으로 서로 나란히 조밀하게 배열될 수 있다. ① 충격에 잘 깨지지 않도록 유연하게 하려면 ㉮보다 ㉯로 이루어진 소재가 적합하겠군. ② 포장된 물품이 잘 보이게 하려면 포장재로는 ㉮보다 ㉯로 이루어진 소재가 적합하겠군. ③ 보관 용기에서 화학 물질이 닿는 부분에는 ㉮보다 ㉯로 이루어진 소재를 쓰는 것이 좋겠군. ④ ㉯보다 ㉮로 이루어진 소재의 밀도가 더 높겠군. ⑤ 열에 잘 견디게 하려면 ㉯보다 ㉮로 이루어진 소재가 적합하겠군. 11. ⓐ와 문맥상 의미가 가장 가까운 것은? ① 요즘 신도시는 아파트가 대규모로 서로 접해있다. ② 그는 자신의 수상 소식을 오늘에야 접하게되었다. ③ 나는 교과서에서 접한시를 모두 외웠다. ④ 우리나라는 삼면이 바다에 접해있다. ⑤ 우리 집은 공원을 접하고있다.,과학,59
